Game Type:,Hive-PLM
wP - bM,https://entomology.appspot.com/hive.html?bg=0&color=1&grid=0&label=1&mode=edit&board=wP+0+0bM-1+1&title=HV-aaronh-tanksc-2015-04-16-0242%20::%20N:345%20whitewin:41%25%20blackwin:52%25%20draw:7%25,345,141,40.869565217391305,180,52.17391304347826,24,6.956521739130435,"HV-jew-tanksc-2015-04-16-0127, HV-tanksc-nevir-2015-04-01-0653, HV-ogreye77-Dumbot-2015-08-22-1545, HV-Dumbot-guest-2015-12-16-0421, HV-Dumbot-KoolFool-2015-12-09-0234, HV-chasheen-nevir-2015-02-03-1737, HV-Dumbot-dokss-2015-01-09-0704, HV-yettowin-Dumbot-2015-01-09-0319, HV-atdandy-nevir-2015-01-16-1653, HV-tanksc-nevir-2015-01-16-1437, T!HV-bluess-Bechster-2015-06-28-0556, T!HV-stepanzo-aaronheit-2015-05-31-0320, HV-mandrake-Dumbot-2015-06-08-2148, T!HV-bluess-aaronh-2015-06-08-0126, T!HV-bluess-aaronh-2015-06-08-0209, HV-ewjimmy-tanksc-2015-06-26-1227, HV-tanksc-Eucalyx-2015-06-27-1407, T!HV-YoungWilli-ewjimmy-2015-06-23-1914, T!HV-YoungWilli-ewjimmy-2015-06-25-1640, T!HV-Kobajagi-Eucalyx-2015-06-05-1230, U!HV-jew-Kobajagi-2015-06-05-0406, HV-tanksc-Bechster-2015-03-13-0726, HV-tanksc-Bechster-2015-03-20-0825, HV-shogi-nevir-2015-03-25-0400, HV-tanksc-nevir-2015-03-25-0831, HV-tanksc-shogi-2015-03-25-0643, HV-kjohnston-spacefood-2015-05-12-1803, T!HV-YoungWilli-kdladage-2015-05-17-1756, U!HV-ringersoll-jew-2015-05-26-0137, HV-ogreye77-Dumbot-2015-09-13-0146, HV-Dumbot-smatt-2016-08-06-2236, HV-guest-Dumbot-2016-12-16-1332, HV-Dumbot-Cyrax-2016-06-04-1358, HV-guest-Dumbot-2016-11-11-1422, HV-guest-guest-2016-11-03-0224, HV-guest-guest-2016-11-05-0040, HV-guest-guest-2016-11-05-1710, HV-guest-guest-2016-11-06-1701, HV-Loizz-Dumbot-2017-03-31-1656, HV-guest-guest-2017-08-03-0235, HV-guest-guest-2017-08-16-0056, HV-guest-guest-2017-07-29-0141, HV-guest-guest-2017-08-01-0145, HV-guest-guest-2017-08-03-0221, HV-tongan-SmartBot-2017-12-28-1329, U!HV-chicken-Dumbot-2017-02-26-1646, HV-painterbob-Dumbot-2017-02-04-1921, HV-guest-Dumbot-2016-12-30-0541, HV-Loizz-Bechster-2017-07-10-1945, T!HV-Loizz-Pseudomon-2017-07-18-2018, HV-Frasco92-Cyrax-2017-07-01-1246, T!HV-HappyKiwi-Loizz-2017-07-04-2008, T!HV-Loizz-HappyKiwi-2017-07-04-1951, T!HV-HappyKiwi-Pseudomon-2017-06-11-0812, T!HV-Bechster-Eucalyx-2017-06-26-0741, HV-painterbob-Dumbot-2017-03-15-0110, T!HV-Pseudomon-Frasco92-2017-05-08-1941, T!HV-Pseudomon-Bechster-2017-05-06-0506, HV-tongan-SmartBot-2017-11-25-1248, U!HV-guest-guest-2017-09-13-0038, HV-tongan-SmartBot-2017-09-22-2320, U!HV-seydel-macmac-2017-09-07-0917, T!HV-Pseudomon-davideg-2018-08-13-1912, HV-dimitrif-zhuangzi-2018-07-12-1550, HV-Dumbot-shcrub-2018-07-24-2227, HV-shcrub-Dumbot-2018-07-24-1606, HV-smatt-SmartBot-2018-06-18-2308, HV-WeakBot-guest-2018-06-01-1328, HV-SmartBot-tongan-2018-02-28-1332, HV-guest-guest-2018-05-20-2055, HV-jfs489-nevir-2018-05-28-1744, HV-Dumbot-guest-2019-12-01-1820, HV-tongan-SmartBot-2019-02-05-0222, HV-SmartBot-m3scaline-2018-12-30-0530, HV-Dumbot-Lemonish-2019-01-26-1213, HV-WeakBot-arrayking-2019-01-26-0328, T!HV-Eucalyx-Frasco92-2019-07-07-0713, T!HV-jdokakill-BogdanM-2019-06-09-2236, T!HV-MaxShark-saltylick-2019-06-09-2054, HV-apolloq-nevir-2019-06-12-0152, T!HV-Eucalyx-Pseudomon-2019-06-20-0430, T!HV-shturik-apolloq-2019-06-24-1823, T!HV-Loizz-saltylick-2019-06-02-2104, HV-ddyer-saltylick-2019-03-24-2054, HV-guest-nevir-2019-03-28-1626, HV-Dumbot-jaykeen-2019-05-19-1656, HV-guest-SmartBot-2019-05-07-1608, HV-gandac-ringersoll-2019-11-16-1239, HV-MasCo-WeakBot-2019-10-17-1158, HV-MasCo-WeakBot-2019-10-26-1415, HV-MasCo-WeakBot-2019-10-29-1035, HV-Dumbot0-makobwoy-2020-03-28-2329, U!HV-VYCMajor-Fredski-2020-04-17-1104, T!HV-stefkal-BoardinATL-2020-04-21-1847, T!HV-Laci55555-dbingeman-2020-04-22-1716, T!HV-Loizz-docster-2020-04-22-2124, HV-UNtMySpvsr-WeakBot1-2020-04-28-0022, HV-luko-WeakBot1-2020-02-08-1041, HV-Loizz-Dumbot-2020-01-24-2029, HV-Loizz-Dumbot-2020-01-25-0945, HV-Loizz-Dumbot1-2020-01-25-0956, HV-WeakBot-luko-2020-01-15-0715, HV-rizeagain-WeakBot1-2020-06-10-0004, T!HV-hawk81-fbaumann-2020-06-10-1803, HV-apolloq-jayhawk-2020-06-19-1932, HV-hawk81-WeakBot1-2020-06-21-1147, HV-peter7-guest-2020-06-24-1930, HV-WeakBot0-rizeagain-2020-06-22-0257, HV-Loizz-SmartBot1-2020-06-07-1008, T!HV-Codysaurus-shturik-2020-06-06-1513, U!HV-gandac-SmartBot-2020-06-02-1138, HV-BoardinATL-Dumbot1-2020-05-12-0317, HV-nevir-Loizz-2020-05-11-1658, T!HV-gandac-Marko60-2020-05-11-1458, T!HV-rizeagain-stepanzo-2020-05-11-0432, T!HV-chaos00-Jewdokakil-2020-05-02-0202, T!HV-rizeagain-iserp-2020-04-30-2111, T!HV-VYCMajor-Geroid-2020-05-01-1606, T!HV-peter7-Benja-2020-05-20-1419, T!HV-Codysaurus-Turkster-2020-05-23-1605, HV-gandac-nevir-2020-05-25-1548, HV-Laci55555-Dumbot1-2020-05-26-1347, HV-SmartBot0-UNtMySpvsr-2020-05-26-2320, HV-UNtMySpvsr-SmartBot1-2020-05-25-1933, T!HV-gandac-neighlles-2020-05-27-1302, HV-WeakBot0-guest-2020-05-04-2124, T!HV-Jewdokakil-chaos00-2020-05-02-0302, HV-Loizz-Geroid-2020-05-08-1302, HV-Loizz-nevir-2020-05-07-1633, HV-saltylick-BoardinATL-2020-05-07-0251, T!HV-gandac-Marko60-2020-05-07-1554, T!HV-VYCMajor-Geroid-2020-05-05-1416, U!HV-lambda22-Loizz-2020-05-05-1001, HV-guest-Gordo-2020-07-05-0244, T!HV-Jewdokakil-nevir-2020-07-04-0023, U!HV-ClaudiuMe-Frasco92-2020-07-03-1723, U!HV-Gordo-Loizz-2020-07-04-1447, U!HV-hawk81-Loizz-2020-07-03-1721, U!HV-Loizz-Frasco92-2020-07-03-1654, U!HV-Loizz-Gordo-2020-07-04-1427, U!HV-Loizz-ringersoll-2020-07-04-1549, ","HV-aaronh-tanksc-2015-04-16-0242, HV-tanksc-nevir-2015-04-04-1156, HV-Benihona-Dumbot-2015-08-03-0129, HV-Dumbot-bof-2015-12-03-2324, HV-PainterBob-Dumbot-2015-02-12-2242, HV-Dumbot-Bechster-2015-02-17-0824, HV-Dumbot-guest-2014-12-29-2012, HV-dokss-Dumbot-2015-01-08-1824, HV-nevir-Bechster-2015-01-09-1934, HV-atdandy-nevir-2015-01-16-1805, HV-TreeNewBee-Dumbot-2015-01-17-2043, HV-c4rl0s-nevir-2015-01-27-2059, HV-Dumbot-Eucalyx-2015-07-21-0231, HV-Dumbot-dodger-2015-07-22-0929, HV-Dumbot-shogi-2015-07-22-1602, T!HV-bluess-Bechster-2015-06-28-0621, T!HV-bluess-Bechster-2015-06-28-0640, HV-osnoca-nevir-2015-05-29-2056, T!HV-YoungWilli-ringersoll-2015-06-06-1102, HV-Dumbot-guest-2015-06-11-1718, HV-mandrake-tanksc-2015-06-11-0827, HV-jew-Dumbot-2015-06-22-0444, HV-ryden-Eucalyx-2015-06-22-1433, T!HV-aaronh-nevir-2015-06-20-1554, T!HV-YoungWilli-ewjimmy-2015-06-22-1458, T!HV-YoungWilli-ewjimmy-2015-06-25-1754, HV-Dumbot-tanksc-2015-06-05-0809, U!HV-Kobajagi-jew-2015-06-05-0210, HV-Agus45-nevir-2015-03-13-0813, HV-Dumbot-jew-2015-05-15-0112, HV-spacefood-kjohnston-2015-05-12-1747, HV-Dumbot-jew-2015-05-22-2105, HV-kdladage-Bechster-2015-05-03-1633, HV-slothgirl-stepanzo-2015-05-02-2014, T!HV-aaronh-Eucalyx-2015-05-04-0326, T!HV-aaronh-Eucalyx-2015-05-04-0407, HV-Dumbot-bof-2015-11-19-1943, HV-Dumbot-bof-2015-11-23-2046, HV-Dumbot-bof-2015-11-28-1744, HV-ogreye77-Dumbot-2015-09-10-2244, HV-ogreye77-Dumbot-2015-09-20-0154, HV-ogreye77-Dumbot-2015-09-25-2056, HV-Dumbot-guest-2015-08-31-1702, HV-lambda22-Dumbot-2016-04-17-0507, U!HV-guest-Dumbot-2016-04-17-0551, HV-ACSlayter-tanksc-2016-04-24-0430, U!HV-Dumbot-RoXar-2016-04-22-1124, HV-Dumbot-guest-2016-08-25-1829, HV-guest-tanksc-2016-01-29-1328, HV-Tiablo-Dumbot-2016-06-23-1827, HV-massi-Cyrax-2016-05-15-1729, HV-Cyrax-titi91-2016-05-01-1622, HV-Cyrax-nevir-2016-05-08-0817, HV-flysuppo-ringersoll-2017-04-08-1959, HV-Dumbot-dodger-2017-04-11-1643, HV-Jubal-Dumbot-2017-04-19-0252, T!HV-dantheman8-Eucalyx-2017-04-19-2021, HV-bpalermo-Dumbot-2017-04-24-2300, HV-MacMac-seydel-2017-12-09-1254, HV-Dumbot-nevir-2017-11-27-1203, HV-Dumbot-nevir-2017-11-27-2207, T!HV-Pseudomon-Eucalyx-2017-06-27-1113, HV-tongan-tanksc-2017-07-22-0220, HV-tongan-tanksc-2017-07-22-0804, T!HV-HappyKiwi-Eucalyx-2017-07-01-0811, T!HV-HappyKiwi-Pseudomon-2017-06-11-1601, U!HV-Dumbot-Loizz-2017-06-11-2219, HV-Dumbot-Cyrax-2017-06-16-2024, HV-Dumbot-guest-2017-06-16-2156, HV-Cyrax-Dumbot-2017-06-21-1316, T!HV-Bechster-Eucalyx-2017-06-24-0704, T!HV-Loizz-Eucalyx-2017-06-25-1146, T!HV-mawelman-Bechster-2017-05-10-1939, HV-Cedricfou5-Dumbot-2017-05-13-1809, T!HV-HappyKiwi-Eucalyx-2017-05-13-0038, T!HV-HappyKiwi-lambda22-2017-05-14-1859, T!HV-HappyKiwi-Eucalyx-2017-05-28-0916, U!HV-Dumbot-nevir-2017-11-09-0300, U!HV-SmartBot-nevir-2017-11-11-1902, HV-SmartBot-nevir-2017-10-13-1401, HV-iongler-Dumbot-2017-10-19-1059, HV-SmartBot-nevir-2017-09-26-1541, HV-Dumbot-nevir-2017-09-03-0316, HV-Dumbot-nevir-2017-09-03-0555, HV-SmartBot-nevir-2017-09-05-0348, HV-SmartBot-Loizz-2018-04-09-1717, HV-ddyer-Pivert94-2018-04-23-0049, HV-WeakBot-Cathaoir-2018-08-26-1907, HV-arrayking-SmartBot-2018-12-21-1435, HV-hudsonism-SmartBot-2018-12-03-0259, HV-Dumbot-nevir-2018-02-14-0609, HV-Dumbot-nevir-2018-01-12-1916, HV-Dumbot-nevir-2018-01-12-2124, HV-zhuangzi-dimitrif-2018-07-13-1953, HV-Dumbot-neighlles-2018-07-15-1710, HV-shcrub-Dumbot-2018-07-24-1554, HV-WeakBot-jfs489-2018-06-09-1514, HV-jdokakill-nevir-2018-06-11-1704, HV-WeakBot-shogi-2018-06-20-0453, HV-WeakBot-shogi-2018-06-23-0339, T!HV-jfs489-Happykiwi-2018-04-29-2012, T!HV-Rickior-Jubal-2018-04-29-2022, HV-caylus-Dube-2018-05-08-1728, HV-jfs489-mdp-2018-05-06-1947, HV-smatt-SmartBot-2018-05-07-0219, HV-cjohnson-Mcbeup-2018-05-11-1806, HV-neighlles-Dumbot-2018-05-12-1935, HV-SmartBot-Loizz-2018-09-25-1213, HV-saltylick-ringersoll-2018-09-20-2324, T!HV-Loizz-davideg-2019-04-24-1652, T!HV-MaxShark-dube-2019-04-23-0619, HV-Dumbot-tanksc-2019-04-02-0659, T!HV-Loizz-Pseudomon-2019-08-09-1702, HV-WeakBot-apolloq-2019-02-18-0554, U!HV-WeakBot-arrayking-2019-01-25-2307, HV-SmartBot-Pelle-2019-07-08-1010, HV-WeakBot-ringersoll-2019-07-10-1004, HV-ddyer-saltylick-2019-07-02-0418, T!HV-MaxShark-Pseudomon-2019-06-29-1402, HV-apolloq-saltylick-2019-06-13-0329, HV-MaxShark-Chrometal-2019-06-17-0702, T!HV-jbchaubet-stepanzo-2019-06-26-0431, HV-Dumbot-guest-2019-03-29-1024, U!HV-SmartBot-nevir-2019-03-28-1502, HV-jaykeen-Dumbot-2019-05-13-0137, HV-jaykeen-Dumbot-2019-05-13-0210, HV-jaykeen-Dumbot-2019-05-13-0238, HV-Dumbot-jaykeen-2019-05-19-1528, T!HV-Frasco92-nevir-2019-05-28-1900, HV-guest-saltylick-2019-11-11-0801, HV-WeakBot-MasCo-2019-11-23-0311, HV-WeakBot-MasCo-2019-10-30-1227, HV-WeakBot-MasCo-2019-11-01-1310, HV-WeakBot-MasCo-2019-10-13-1258, HV-MasCo-WeakBot-2019-10-26-1301, HV-Rufeo612-WeakBot-2019-09-11-2026, HV-WeakBot0-guest-2020-04-12-2210, HV-chaos00-WeakBot1-2020-04-21-0531, T!HV-caprinus2-Codysaurus-2020-04-25-1646, T!HV-dbingeman-Laci55555-2020-04-24-1732, HV-caprinus2-nevir-2020-04-26-1748, HV-caprinus2-ringersoll-2020-04-26-1850, HV-chaos00-WeakBot1-2020-04-27-0523, HV-Dumbot0-BoardinATL-2020-04-28-2308, HV-Dumbot0-guest-2020-04-26-1709, HV-WeakBot0-luko-2020-02-21-0836, HV-guest-Dumbot-2020-01-17-0939, HV-2morrow-WeakBot-2020-01-03-2149, T!HV-Loizz-csigeee-2020-06-10-1151, T!HV-rizeagain-Eucalyx-2020-06-08-0313, T!HV-rizeagain-Eucalyx-2020-06-09-0401, HV-UNtMySpvsr-SmartBot1-2020-05-31-0045, HV-jayhawk-apolloq-2020-06-19-1922, T!HV-gandac-Eucalyx-2020-06-19-0808, T!HV-Marko60-zacbell-2020-06-20-1744, T!HV-peter7-RaiD-2020-06-21-1832, HV-Journeyboy-saltylick-2020-06-04-0027, HV-Laci55555-Dumbot1-2020-06-05-1603, HV-Marko60-WeakBot1-2020-06-06-0211, HV-JagamhnDas-WeakBot1-2020-02-25-2112, HV-WeakBot0-JagamhnDas-2020-02-27-2344, U!HV-WeakBot0-JagamhnDas-2020-03-03-2254, T!HV-Codysaurus-saltylick-2020-05-09-1714, HV-Dumbot0-BoardinATL-2020-05-14-0119, T!HV-Loizz-csigeee-2020-05-16-1143, T!HV-ronics-nevir-2020-04-30-1612, HV-Dumbot0-caprinus2-2020-05-20-0316, HV-guest-Dumbot1-2020-05-17-1328, HV-SmartBot0-nevir-2020-05-26-0053, U!HV-rizeagain-WeakBot-2020-05-26-0025, HV-Rufeo612-WeakBot1-2020-05-04-1609, T!HV-chaos00-Jewdokakil-2020-05-02-0314, HV-guest-saltylick-2020-07-07-2233, HV-WeakBot0-guest-2020-07-05-0401, HV-WeakBot0-rizeagain-2020-07-03-0153, T!HV-Jewdokakil-nevir-2020-06-27-0037, T!HV-Jewdokakil-nevir-2020-06-27-0041, T!HV-MaxShark-RaiD-2020-07-05-2102, T!HV-VYCMajor-fbaumann-2020-07-05-0951, U!HV-guest-Gordo-2020-07-03-2315, ","HV-Dumbot-c4rl0s-2015-01-13-1600, HV-stepanzo-jew-2015-05-29-2223, T!HV-aaronheit-stepanzo-2015-05-31-0328, T!HV-aaronheit-ewjimmy-2015-05-10-1814, HV-tanksc-nevir-2016-05-14-0536, HV-SmartBot-tongan-2017-08-22-1530, HV-Dumbot-Cyrax-2017-06-24-0951, HV-guest-Dumbot-2017-03-20-1409, HV-Dumbot-Cyrax-2017-04-28-1335, U!HV-guest-Dumbot-2017-05-03-1819, HV-Zeferous-Dumbot-2018-03-31-1307, HV-Dumbot-guest-2018-12-14-2308, HV-Dumbot-dimitrif-2018-07-18-1637, HV-Jubal-Rickior-2018-04-29-1939, HV-ckunka-dube-2018-05-28-2040, HV-ddyer-ckunka-2019-03-31-2306, T!HV-Eucalyx-dube-2019-06-30-0520, T!HV-Eucalyx-aenorman43-2019-06-02-0144, T!HV-MaxShark-stepanzo-2019-05-06-0503, HV-androidai-mzingaai-2019-11-16-1805, HV-androidai-mzingaai-2019-11-27-0134, T!HV-iserp-ringersoll-2020-05-31-2049, T!HV-nevir-MaxShark-2020-05-12-1604, HV-Rufeo612-WeakBot1-2020-05-20-0009, "
wA1 - bP,https://entomology.appspot.com/hive.html?bg=0&color=1&grid=0&label=1&mode=edit&board=bP+1+0wA1+0+0&title=HV-Dumbot-aaronh-2015-04-15-0324%20::%20N:138%20whitewin:28%25%20blackwin:70%25%20draw:2%25,138,38,27.536231884057973,97,70.28985507246377,3,2.1739130434782608,"HV-Dumbot-aaronh-2015-04-15-0324, HV-nevir-tanksc-2015-03-31-0828, HV-Dumbot-smatt-2015-08-12-0223, HV-Dumbot-yettowin-2015-01-30-0151, T!HV-nevir-preve-2015-07-02-2059, HV-Bechster-tanksc-2015-05-28-0839, HV-nevir-tanksc-2015-06-23-0658, HV-nevir-tanksc-2015-03-24-0752, HV-shogi-tanksc-2015-03-25-0702, HV-nevir-tanksc-2015-10-31-0606, U!HV-nevir-Bechster-2016-03-30-1941, HV-Dumbot-guest-2015-12-27-2232, HV-nevir-Bechster-2016-03-24-2100, HV-nevir-Dumbot-2016-03-25-0621, U!HV-nevir-Bechster-2016-03-28-2140, HV-nevir-Bechster-2016-05-09-1911, U!HV-Bechster-nevir-2016-05-06-2251, U!HV-nevir-Bechster-2016-05-07-1601, HV-Dube-tanksc-2017-07-02-0717, T!HV-stepanzo-Radek0-2017-06-08-0349, T!HV-Eucalyx-Loizz-2017-06-25-1215, HV-nevir-SmartBot-2017-05-27-0144, HV-Dumbot-guest-2017-05-04-1833, HV-Dumbot-Rickior-2018-03-31-2017, HV-saltylick-ddyer-2018-03-28-0213, HV-saltylick-ckunka-2018-04-02-2323, HV-saltylick-guest-2018-04-03-0132, T!HV-saltylick-Eucalyx-2018-06-27-2303, T!HV-Radek0-fbaumann-2018-06-05-1821, HV-Dumbot-Peckhead-2018-03-12-0832, HV-saltylick-Eucalyx-2018-09-15-0246, HV-ssmmww-SmartBot-2019-02-03-1745, HV-saltylick-Dumbot-2019-07-16-0730, HV-saltylick-squishyy-2019-05-10-0025, HV-SmartBot-apolloq-2019-05-11-0327, U!HV-saltylick-tanksc-2019-05-22-0554, HV-PlayerOne-PlayerTwo-2020-03-28-2048, T!HV-saltylick-Laci55555-2020-05-04-0451, ","HV-Dumbot-tanksc-2015-04-02-0229, HV-nevir-tanksc-2015-04-01-0722, HV-nevir-tanksc-2015-04-02-0446, HV-craft-tanksc-2015-04-04-1124, HV-craft-tanksc-2015-04-04-1129, HV-nevir-tanksc-2015-04-04-1151, HV-Dumbot-dodger-2015-07-31-1200, HV-Dumbot-dodger-2015-08-03-1010, HV-Dumbot-jew-2015-07-03-1329, HV-Bechster-tanksc-2015-05-28-0841, HV-Eucalyx-tanksc-2015-06-23-0845, HV-Eucalyx-tanksc-2015-06-23-0857, HV-nevir-tanksc-2015-03-18-0747, HV-nevir-tanksc-2015-03-24-0708, HV-nevir-tanksc-2015-03-25-0801, HV-nevir-tanksc-2015-03-26-0709, U!HV-nevir-tanksc-2015-03-06-0701, HV-Dumbot-shogi-2015-05-03-1535, HV-guest-Dumbot-2015-05-03-2129, HV-nevir-tanksc-2015-10-09-0315, HV-Dumbot-nevir-2016-04-09-1423, HV-Dumbot-guest-2016-04-21-1223, U!HV-nevir-Bechster-2016-03-29-1905, HV-Coolman576-JTB-2016-05-28-0315, U!HV-Bechster-nevir-2016-03-28-1702, HV-Dumbot-bpalermo-2017-04-14-1824, HV-SmartBot-guest-2017-12-06-1344, U!HV-Dumbot-TMarshal-2017-07-14-1618, HV-guest-Dumbot-2017-07-18-2352, HV-Dumbot-tongan-2017-07-05-1220, HV-nevir-Bechster-2017-06-09-0731, HV-Bechster-HappyKiwi-2017-06-14-1753, T!HV-Bechster-HappyKiwi-2017-06-15-2031, HV-Bechster-Loizz-2017-06-22-2106, HV-Dumbot-Loizz-2017-03-21-1830, T!HV-nevir-stepanzo-2017-04-28-0136, T!HV-va1kyrie-c4nnes-2017-05-12-2034, T!HV-PrezTrump-iserp-2017-05-21-2350, HV-seydel-MacMac-2017-11-13-1804, HV-SmartBot-tongan-2017-11-18-0638, HV-seydel-MacMac-2017-10-28-1155, HV-SmartBot-tongan-2017-10-27-1309, HV-SmartBot-tongan-2017-09-17-0724, HV-SmartBot-tongan-2017-09-24-0617, HV-Dumbot-nevir-2017-09-03-0414, HV-Dumbot-nevir-2017-09-03-0503, HV-Dumbot-nevir-2017-09-03-0604, HV-Dumbot-nevir-2017-09-05-0513, HV-SmartBot-nevir-2017-09-05-0128, HV-Dumbot-nevir-2017-09-06-0430, HV-Dumbot-nevir-2017-09-06-1721, U!HV-seydel-macmac-2017-09-07-0852, U!HV-seydel-macmac-2017-09-07-0907, HV-saltylick-ckunka-2018-03-28-2146, HV-SmartBot-Jubal-2018-04-21-2020, HV-saltylick-nevir-2018-04-03-0321, HV-Dumbot-antsac-2018-07-23-2156, HV-Dumbot-shcrub-2018-07-23-2219, HV-shogi-saltylick-2018-07-22-0246, HV-Dumbot-Bogusz-2018-06-09-1910, HV-nevir-Dube-2018-05-31-1936, HV-guest-SmartBot-2018-03-15-2209, HV-SmartBot-Jubal-2018-04-29-1844, HV-saltylick-Dube-2018-05-29-2328, U!HV-Dumbot-guest-2018-10-09-0842, U!HV-Dumbot-guest-2018-10-13-1713, HV-1472-saltylick-2018-09-06-0518, HV-saltylick-ringersoll-2018-09-15-0010, HV-WeakBot-MasCo-2019-12-12-1217, HV-Dumbot-Lemonish-2019-01-24-1728, HV-WeakBot-guest-2019-01-24-2117, T!HV-ringersoll-Pseudomon-2019-07-14-0956, T!HV-neighlles-dube-2019-07-28-0250, HV-Hex87-saltylick-2019-06-09-0408, HV-apolloq-Dumbot-2019-06-13-0302, HV-SmartBot-guest-2019-06-17-2309, HV-Smartie-WeakBot-2019-05-10-1427, HV-saltylick-guest-2019-05-08-0450, HV-mzingaai-SmartBot-2019-11-25-0223, HV-WeakBot-MasCo-2019-11-07-1032, HV-WeakBot-MasCo-2019-10-13-1231, HV-WeakBot-MasCo-2019-10-27-0723, HV-Rufeo612-WeakBot-2019-09-28-1530, HV-makobwoy-Dumbot-2020-03-28-1137, HV-SmartBot0-Codysaurus-2020-03-29-2019, U!HV-SmartBot0-guest-2020-04-08-1640, HV-Dumbot0-Laci55555-2020-04-21-0847, HV-makobwoy-WeakBot1-2020-04-23-0942, HV-Dumbot0-Laci55555-2020-04-24-1359, HV-Dumbot0-Laci55555-2020-04-25-1030, HV-WeakBot-UNtMySpvsr-2020-04-26-2210, HV-WeakBot0-JagamhnDas-2020-03-07-1915, T!HV-Inma-Eucalyx-2020-04-30-2353, T!HV-Inma-Eucalyx-2020-05-01-0005, HV-Dumbot0-Laci55555-2020-05-26-1426, HV-guest-Dumbot1-2020-07-01-0012, U!HV-WeakBot0-JagamhnDas-2020-07-03-2235, ","HV-nevir-tanksc-2015-03-18-0646, HV-Dumbot-guest-2016-01-02-2237, HV-nevir-SmartBot-2017-05-22-1849, "
wB1 - bP,https://entomology.appspot.com/hive.html?bg=0&color=1&grid=0&label=1&mode=edit&board=bP+1+0wB1+0+0&title=HV-Dumbot-aaronh-2015-04-16-0202%20::%20N:104%20whitewin:32%25%20blackwin:64%25%20draw:4%25,104,33,31.73076923076923,67,64.42307692307692,4,3.8461538461538463,"HV-Dumbot-jew-2015-04-27-0108, HV-guest-Dumbot-2015-04-27-2217, HV-taniel-Dumbot-2015-08-12-0649, HV-Dumbot-guest-2015-08-18-0211, HV-segasa-Dumbot-2015-08-23-2021, HV-Dumbot-Bechster-2015-12-13-2112, HV-Dumbot-c4rl0s-2015-01-13-2340, HV-Dumbot-nevir-2016-04-23-1836, HV-Dumbot-Megoo-2017-03-20-0923, HV-Dumbot-radpaul7-2017-05-09-1830, HV-dacajun-flysuppo-2017-05-10-0718, U!HV-Dumbot-Cedricfou5-2017-05-12-1830, HV-SmartBot-tongan-2017-10-26-1322, HV-guest-guest-2017-09-05-0059, HV-seydel-MacMac-2017-09-08-0751, HV-Dumbot-Cathaoir-2018-08-24-0004, HV-guest-Dumbot-2018-08-27-2231, HV-guest-guest-2018-02-21-0705, HV-guest-guest-2018-02-21-0737, HV-guest-Dumbot-2018-07-13-1005, HV-Dumbot-guest-2018-07-27-0355, T!HV-bluess-ckunka-2018-05-10-2228, HV-caylus-Silejonu-2018-05-20-1718, U!HV-Dhalia-WeakBot-2018-10-13-1755, HV-saltylick-Caprinus-2019-08-30-0445, HV-Dumbot-Lemonish-2019-01-27-2308, HV-Dumbot-Lemonish-2019-02-03-2100, HV-SmartBot-arrayking-2019-01-17-1033, HV-caitfish-Cletus-2020-04-26-0525, HV-WeakBot0-JagamhnDas-2020-03-13-2035, HV-WeakBot-JagamhnDas-2020-05-11-2352, U!HV-Twes-WeakBot1-2020-05-10-1936, U!HV-shturik-SmartBot1-2020-04-30-1519, ","HV-Dumbot-aaronh-2015-04-16-0202, HV-Dumbot-aaronh-2015-02-23-0323, HV-Dumbot-humdeabril-2015-02-03-0813, HV-guest-Dumbot-2015-07-19-1846, HV-guest-Dumbot-2015-06-15-1910, T!HV-ewjimmy-YoungWilli-2015-06-19-1340, HV-Shad3r-Dumbot-2015-05-14-1530, HV-Bertuccia-Dumbot-2015-09-23-2246, HV-nzc-Dumbot-2015-09-06-2354, HV-Dumbot-nevir-2016-04-07-1531, U!HV-guest-Dumbot-2016-04-17-0515, HV-piens-Dumbot-2016-08-08-2149, HV-kdladage-Dumbot-2016-01-07-2157, U!HV-Dumbot-kingofcups-2016-01-18-0021, HV-ROG70-Dumbot-2016-06-14-2341, HV-Dumbot-guest-2016-11-06-2222, HV-peter84-Dumbot-2016-10-19-0428, HV-Dumbot-Loizz-2017-04-03-1344, HV-guest-Dumbot-2017-08-09-1431, HV-SmartBot-guest-2017-12-05-1518, HV-Dumbot-chicken-2017-02-26-2125, HV-SmartBot-tongan-2017-07-02-1340, HV-SmartBot-Mallinalli-2017-06-26-1454, U!HV-guest-Dumbot-2017-03-24-1939, HV-Dumbot-guest-2017-05-01-1341, HV-Dumbot-guest-2017-05-01-1600, HV-Dumbot-guest-2017-05-05-1749, HV-Dumbot-guest-2017-05-06-2052, HV-SmartBot-tongan-2017-08-30-1110, HV-SmartBot-tongan-2017-08-31-1356, HV-seydel-MacMac-2017-09-11-2119, HV-Dumbot-nevir-2017-09-03-0349, HV-Dumbot-nevir-2017-09-05-0154, HV-Dumbot-nevir-2017-09-05-0536, HV-SmartBot-nevir-2017-09-04-2308, HV-Dumbot-nevir-2017-09-06-2009, HV-Dumbot-nevir-2017-09-08-0317, HV-seydel-MacMac-2017-09-07-1823, HV-SmartBot-tongan-2017-09-08-2256, HV-bluess-Bechster-2018-04-21-2005, HV-Dumbot-Rickior-2018-04-03-1458, HV-SmartBot-guest-2018-04-07-1704, HV-Dumbot-Cathaoir-2018-08-24-2117, HV-Dumbot-Bogusz-2018-06-11-1033, HV-Bamka19-SmartBot-2018-05-14-1830, U!HV-guest-Dumbot-2018-11-12-1920, HV-SkullNBone-alh1113-2018-10-28-2224, HV-Dumbot-guest-2018-10-16-1922, HV-zippy-Dumbot-2019-04-28-0026, HV-guest-WeakBot-2019-12-05-0745, HV-WeakBot-KingForest-2019-02-07-2352, HV-imipolexg-SmartBot-2019-01-10-2023, HV-WeakBot-arrayking-2019-01-26-1243, U!HV-WeakBot-arrayking-2019-01-25-2324, U!HV-WeakBot-arrayking-2019-01-25-2334, HV-ajrees-Dumbot-2019-06-06-0951, HV-WeakBot-MasCo-2019-10-25-1317, HV-WeakBot-MasCo-2019-10-28-1143, HV-radamsuo16-WeakBot-2019-09-16-0014, HV-Dumbot0-dsheikhp-2020-04-05-0325, HV-Rufeo612-WeakBot1-2020-04-21-1838, T!HV-Rufeo612-IkaTaii-2020-04-21-1959, HV-Dumbot0-Laci55555-2020-04-24-0637, HV-SmartBot-shturik-2020-01-03-0932, HV-SmartBot0-hawk81-2020-06-11-0841, HV-WeakBot0-guest-2020-06-20-1221, U!HV-Dumbot0-guest-2020-05-18-2238, ","HV-Dumbot-bpalermo-2015-08-21-0230, HV-guest-Dumbot-2016-10-15-2123, HV-guest-guest1484-2018-04-04-0229, HV-WeakBot0-luko-2020-02-15-0835, "
wM - bP,https://entomology.appspot.com/hive.html?bg=0&color=1&grid=0&label=1&mode=edit&board=bP+1+0wM+0+0&title=HV-Dumbot-aaronh-2015-04-16-0253%20::%20N:50%20whitewin:60%25%20blackwin:28%25%20draw:12%25,50,30,60.0,14,28.0,6,12.0,"HV-Dumbot-aaronh-2015-04-16-0253, HV-nevir-Bechster-2015-04-27-0912, HV-Dumbot-mandrake-2015-06-08-0900, HV-guest-Dumbot-2015-06-19-2124, U!HV-ringersoll-Bechster-2015-05-11-0959, HV-bof-Dumbot-2015-11-26-2249, HV-Dumbot-dantheman8-2017-04-10-0032, HV-SmartBot-guest-2017-07-31-0537, HV-jubal-Dumbot-2017-03-17-0135, HV-Dumbot-guest-2017-05-20-2214, HV-Dumbot-guest-2017-05-04-1741, HV-seydel-MacMac-2017-09-24-1936, HV-Loizz-Dumbot-2018-04-09-1733, HV-WeakBot-Cathaoir-2018-08-12-0024, HV-Eucalyx-WeakBot-2018-05-28-2210, HV-WeakBot-MasCo-2019-12-04-1000, U!HV-apolloq-WeakBot-2019-01-11-0422, HV-Dumbot-Lemonish-2019-01-23-1256, HV-Dumbot-jaykeen-2019-05-12-2141, HV-mzingaai-steamai-2019-11-20-0059, HV-SmartBot-steamai-2019-11-25-0137, U!HV-WeakBot-ramotram-2019-10-07-2313, U!HV-WeakBot-ramotram-2019-10-07-2320, HV-Pelle-Dumbot-2019-10-24-2111, HV-Dumbot0-ronics-2020-04-15-1716, HV-Dumbot0-Laci55555-2020-04-20-1508, HV-WeakBot0-UNtMySpvsr-2020-04-25-1646, HV-luko-WeakBot1-2020-02-08-1005, HV-luko-WeakBot-2020-02-19-0858, HV-Dumbot0-guest-2020-05-22-2313, ","U!HV-Dumbot-nevir-2015-01-10-0611, HV-Dumbot-nevir-2015-01-06-1708, HV-Dumbot-dodger-2015-07-22-0913, HV-Dumbot-guest-2016-10-31-2250, HV-Dumbot-guest-2017-04-21-1849, HV-SmartBot-guest-2017-12-06-2200, U!HV-SmartBot-guest-2017-12-04-2225, HV-Dumbot-Rickior-2018-04-01-1828, U!HV-SmartBot-guest-2018-10-13-1244, U!HV-guest-WeakBot-2019-12-11-1705, HV-WeakBot-MasCo-2019-12-04-1005, HV-SmartBot-arrayking-2019-01-16-1326, HV-makobwoy-Dumbot-2019-03-25-1122, HV-luko-WeakBot-2020-01-10-0844, ","T!HV-Pseudomon-HappyKiwi-2017-06-11-0811, HV-SmartBot-tongan-2017-06-22-1300, HV-Dumbot-guest-2017-03-20-1604, HV-Cyrax-SmartBot-2018-02-18-0928, HV-Dumbot-Bogusz-2018-06-10-2024, HV-guest-SmartBot-2018-06-05-1349, "
