Game Type:,Hive-PLM
wS1 - bM,https://entomology.appspot.com/hive.html?bg=0&color=1&grid=0&label=1&mode=edit&board=wS1+0+0bM-1+1&title=U!HV-TMarshal-Dumbot-2015-04-10-2149%20::%20N:156%20whitewin:3%25%20blackwin:1%25%20draw:96%25,156,5,3.2051282051282053,1,0.6410256410256411,150,96.15384615384616,"HV-HautRoi-Meowtastic-2020-04-03-0322, HV-caprinus2-Dumbot1-2020-04-18-0105, HV-candimanf-WeakBot1-2020-04-25-0003, HV-lmartin-WeakBot1-2020-04-26-2051, HV-lmartin-WeakBot1-2020-04-26-2147, ","T!HV-candimanf-caprinus2-2020-04-21-2038, ","U!HV-TMarshal-Dumbot-2015-04-10-2149, U!HV-TMarshal-Dumbot-2015-04-12-0006, U!HV-TMarshal-Dumbot-2015-04-19-1710, U!HV-TMarshal-Dumbot-2015-04-20-2029, U!HV-TMarshal-Dumbot-2015-04-21-2216, U!HV-TMarshal-Dumbot-2015-04-22-2253, U!HV-Screamer-Dumbot-2015-04-03-1836, U!HV-TMarshal-Dumbot-2015-03-31-1918, U!HV-TMarshal-Dumbot-2015-04-01-1653, U!HV-TMarshal-Dumbot-2015-04-01-1743, U!HV-guest-Dumbot-2015-08-13-2153, HV-guest-Dumbot-2015-11-30-1716, U!HV-TMarshal-Dumbot-2014-12-30-0234, HV-tasman-Dumbot-2015-01-07-0934, HV-guest-Dumbot-2015-01-18-1945, U!HV-guest-Dumbot-2015-01-24-1225, U!HV-guest-Dumbot-2015-07-13-2331, HV-thales-Dumbot-2015-07-21-1109, HV-guest-Dumbot-2015-07-02-2100, HV-guest-Dumbot-2015-07-05-2232, HV-higgsi-Dumbot-2015-06-14-0907, U!HV-ryden-Dumbot-2015-06-22-0916, U!HV-TMarshal-Dumbot-2015-06-19-2238, HV-nono-Dumbot-2015-06-27-2110, HV-ryden-QuickLife-2015-06-23-2121, HV-nbushfield-Dumbot-2015-03-09-2042, U!HV-guest-Dumbot-2015-03-13-1248, HV-shogi-Dumbot-2015-03-24-1308, HV-shogi-Dumbot-2015-03-24-1601, HV-valy24-Dumbot-2015-05-12-1318, HV-guest-Dumbot-2015-04-30-2153, HV-TMarshal-Dumbot-2015-05-04-1605, U!HV-TMarshal-Dumbot-2015-04-29-0234, U!HV-TMarshal-Dumbot-2015-04-30-2352, HV-bof-Dumbot-2015-11-23-2125, HV-Dumbot-guest-2015-10-08-1909, HV-BlackBanty-Dumbot-2015-10-19-1713, HV-allahakbar-Dumbot-2015-09-22-2255, HV-Bertuccia-Dumbot-2015-09-23-2138, U!HV-allahakbar-Dumbot-2015-09-23-0902, HV-Tchnx-Dumbot-2016-04-08-1853, HV-guest-Dumbot-2016-08-23-1721, U!HV-Tmarshal-Dumbot-2016-08-03-0122, HV-nicksauce-Dumbot-2016-02-15-0414, HV-dumbledore-Dumbot-2015-12-29-1244, HV-dumbledore-Dumbot-2016-01-11-1323, HV-Dumbot-kkurtonis-2016-01-12-1727, HV-guest-Dumbot-2016-01-06-0057, HV-optissimus-Dumbot-2016-07-02-0243, HV-dragonlord-Dumbot-2016-06-07-1542, U!HV-mrcndrpqn-Dumbot-2016-06-24-1305, HV-kingbing-Dumbot-2016-03-14-1110, HV-Maximosama-Dumbot-2016-11-18-2356, HV-guest-Dumbot-2016-10-14-1944, HV-basilio-Dumbot-2016-09-24-2113, U!HV-TMarshal-Dumbot-2016-09-02-2029, HV-guest-Dumbot-2017-04-09-0029, HV-LaFleur98-Dumbot-2017-04-09-2052, HV-guest-Dumbot-2017-04-20-2140, HV-spanishana-Dumbot-2017-04-24-2125, HV-guest-Dumbot-2017-03-31-2055, U!HV-TMarshal-Dumbot-2017-08-16-2048, U!HV-TMarshal-Dumbot-2017-08-17-0028, HV-timkriek-Dumbot-2017-12-17-0945, U!HV-Serigala-Dumbot-2017-12-12-1409, HV-PsyXo-Dumbot-2017-02-27-1403, HV-Ferr-Dumbot-2017-01-02-1703, U!HV-TMarshal-Dumbot-2017-07-11-1109, U!HV-TMarshal-Dumbot-2017-07-15-1057, U!HV-TMarshal-Dumbot-2017-07-22-2311, U!HV-TMarshal-Dumbot-2017-07-23-1439, HV-teilon-Dumbot-2017-06-23-0720, HV-guest-Dumbot-2017-06-06-1405, HV-Dumbot-jubal-2017-03-18-0508, HV-guest-Dumbot-2017-03-29-0244, HV-guest-Dumbot-2017-05-01-0958, HV-MacMac-seydel-2017-10-09-1750, HV-Pedritoo-Dumbot-2018-04-18-2343, HV-ZoneCold-Dumbot-2018-04-01-0826, HV-Cathaoir-WeakBot-2018-08-17-2216, HV-Cathaoir-WeakBot-2018-08-22-1941, HV-arrayking-Dumbot-2018-12-21-1501, HV-SmartBot-m3scaline-2018-12-19-2136, HV-guest-WeakBot-2018-07-13-1043, HV-dimitrif-Dumbot-2018-07-17-1248, HV-idlebytes-WeakBot-2018-06-14-0359, HV-lexxy777-SmartBot-2018-06-28-0704, U!HV-guest-WeakBot-2018-06-01-1459, HV-Peckhead-SmartBot-2018-03-13-1448, HV-Peckhead-SmartBot-2018-03-15-1345, HV-Peckhead-SmartBot-2018-03-15-1442, HV-lizzzzzzz-poopgoose-2018-03-21-2251, U!HV-TMarshal-Dumbot-2018-03-21-0130, HV-Bboydrew-WeakBot-2018-05-14-2225, HV-guest-SmartBot-2018-05-02-2217, HV-guest-WeakBot-2018-09-29-0419, HV-guest-WeakBot-2018-10-13-2231, U!HV-TMarshal-Dumbot-2018-09-14-2357, U!HV-DodoBirb-Dumbot-2019-04-08-0755, HV-guest-WeakBot-2019-04-24-1826, HV-zippy-Dumbot-2019-04-26-0325, HV-guest1476-WeakBot-2019-04-04-1906, HV-guest-WeakBot-2019-12-12-0632, HV-guest-WeakBot-2019-12-12-0715, U!HV-conky-WeakBot-2019-12-03-0017, U!HV-guest-WeakBot-2019-12-02-0538, U!HV-guest-WeakBot-2019-12-04-0709, U!HV-kayab-WeakBot-2019-11-29-2305, HV-Cathaoir-WeakBot-2019-12-06-1959, HV-radamsuo16-WeakBot-2019-12-06-0642, HV-TirKen-WeakBot-2019-12-07-0745, HV-dodger-SmartBot-2019-01-28-2125, HV-arrayking-Dumbot-2019-01-13-0522, HV-SmartBot-m3scaline-2019-01-04-0523, U!HV-Fabiopoppa-WeakBot-2019-01-05-1809, HV-Cathaoir-WeakBot-2019-07-26-0202, HV-Pirisha-WeakBot-2019-06-20-2306, U!HV-Pirisha-WeakBot-2019-06-20-1612, HV-Pirisha-WeakBot-2019-06-26-0001, HV-RogRab-WeakBot-2019-06-28-0348, HV-harpreet25-Dumbot-2019-03-28-0220, HV-Dumbot-jaykeen-2019-05-13-0111, HV-Dumbot-jaykeen-2019-05-13-0137, U!HV-veld-WeakBot-2019-05-01-2112, HV-Cathaoir-WeakBot-2019-05-25-2201, HV-Tokyo27-Dumbot-2019-05-02-1423, HV-veld-WeakBot-2019-05-02-1738, HV-guest-Dumbot-2019-11-05-1753, HV-guest-WeakBot-2019-10-09-0957, HV-guest-SmartBot-2019-09-29-0934, HV-guest-WeakBot-2019-10-06-1713, U!HV-guest-SmartBot-2019-10-02-1737, HV-radamsuo16-WeakBot-2019-09-12-0554, HV-guest-SmartBot-2019-09-19-1820, HV-guest-SmartBot-2019-09-20-1338, HV-guest-WeakBot-2019-09-19-1935, HV-guest-SmartBot-2019-09-22-1708, HV-guest-SmartBot-2019-09-25-1738, HV-guest-SmartBot-2019-09-28-1555, HV-BoardinATL-SmartBot1-2020-04-13-1712, HV-guest-Dumbot1-2020-04-12-1625, HV-amartinez-WeakBot1-2020-04-14-2042, HV-GKobiec-WeakBot1-2020-04-16-2020, HV-lmartin-WeakBot1-2020-04-26-2109, HV-WeakBot0-luko-2020-02-18-0626, HV-guest1477-WeakBot-2020-01-16-0438, HV-guest-WeakBot-2020-01-18-0116, HV-mcd4wvu-WeakBot-2020-03-08-0045, HV-Overmind-Dumbot1-2020-03-13-0801, HV-veld-WeakBot1-2020-05-15-2020, "
wP - bS1,https://entomology.appspot.com/hive.html?bg=0&color=1&grid=0&label=1&mode=edit&board=wP+0+0bS1-1+1&title=HV-Bechster-Dumbot-2015-04-14-1048%20::%20N:159%20whitewin:13%25%20blackwin:1%25%20draw:86%25,159,21,13.20754716981132,2,1.2578616352201257,136,85.53459119496856,"U!HV-dsheikhp-Dumbot1-2020-03-31-0935, HV-chaos00-WeakBot1-2020-04-19-1720, T!HV-gandac-Witkowski-2020-04-20-1502, HV-Laci55555-Dumbot-2020-04-22-1309, HV-ronics-chaos00-2020-04-24-1923, T!HV-dbingeman-Laci55555-2020-04-25-1742, HV-luko-WeakBot1-2020-02-08-0933, HV-JagamhnDas-WeakBot1-2020-02-24-1723, HV-Loizz-Dumbot-2020-01-24-2054, HV-luko-WeakBot1-2020-02-01-0903, HV-rizeagain-WeakBot1-2020-06-10-0016, HV-UNtMySpvsr-SmartBot1-2020-06-11-1445, HV-SmartBot-poundfist-2020-06-14-2315, HV-Jewdokakil-SmartBot1-2020-06-20-1215, HV-UNtMySpvsr-SmartBot1-2020-06-04-0017, T!HV-rizeagain-stepanzo-2020-05-11-0537, HV-Rufeo612-WeakBot1-2020-05-19-1715, HV-Laci55555-Dumbot1-2020-05-24-1359, U!HV-guest-Dumbot1-2020-05-28-0314, U!HV-guest-Dumbot1-2020-05-28-2025, T!HV-Geroid-CBerserker-2020-05-08-1158, ","U!HV-WeakBot0-OJpimpson-2020-05-31-1801, HV-UNtMySpvsr-SmartBot-2020-06-04-0012, ","HV-Bechster-Dumbot-2015-04-14-1048, U!HV-Dumbot-TMarshal-2015-04-19-2018, U!HV-Dumbot-TMarshal-2015-04-21-2300, HV-bpalermo-Dumbot-2015-08-21-0113, HV-tanksc-amigo-2015-01-13-1401, HV-c4rl0s-ialba-2015-01-18-1749, HV-Dumbot-amigo-2015-01-05-2202, HV-dodger-Dumbot-2015-07-20-0835, U!HV-Dumbot-TMarshal-2015-05-28-2014, HV-Dumbot-mirthmatte-2015-06-16-1321, HV-Dumbot-nono-2015-06-23-1900, HV-Dumbot-nbushfield-2015-03-09-2057, HV-tanksc-guest-2015-03-23-0106, HV-squishyou-Dumbot-2015-05-10-0428, HV-Kobajagi-osnoca-2015-05-13-2127, HV-valy24-Dumbot-2015-05-12-1532, U!HV-Dumbot-TMarshal-2015-05-11-1424, U!HV-Dumbot-TMarshal-2015-05-17-1306, U!HV-Dumbot-TMarshal-2015-05-17-1333, HV-Dumbot-TMarshal-2015-05-23-0211, U!HV-Dumbot-TMarshal-2015-05-20-1031, U!HV-Dumbot-TMarshal-2015-09-11-2332, HV-Dumbot-ci00rix-2016-04-15-2122, U!HV-guest-Dumbot-2016-04-17-0443, U!HV-Dumbot-TMarshal-2016-08-24-2035, HV-Dumbot-LuisGiRo-2016-08-06-2315, HV-Dumbot-enoteco-2016-01-05-1757, HV-guest-Dumbot-2016-05-03-2259, HV-guest-guest-2016-10-31-0107, HV-guest-Dumbot-2016-11-14-0032, HV-guest-guest-2016-10-28-0201, U!HV-Dumbot-TMarshal-2016-09-11-0123, T!HV-Bechster-BogdanM-2017-04-21-1451, HV-painterbob-Dumbot-2017-04-03-2359, HV-Dumbot-guest-2017-04-06-1522, HV-tongan-SmartBot-2017-08-20-1039, U!HV-Dumbot-TMarshal-2017-08-25-2154, HV-guest-guest-2017-07-29-0123, U!HV-Dumbot-TMarshal-2017-07-29-1540, HV-tongan-SmartBot-2017-12-03-1010, HV-Krackom-LuisGiRo-2017-02-13-1731, HV-Dumbot-chicken-2017-02-26-0904, HV-stepanzo-lambda22-2017-07-07-0358, U!HV-Dumbot-TMarshal-2017-07-14-2249, U!HV-Dumbot-TMarshal-2017-07-17-2138, HV-Mallinalli-SmartBot-2017-07-02-1205, HV-Mallinalli-Dumbot-2017-06-08-1137, HV-Dumbot-teilon-2017-05-31-0555, HV-Dumbot-teilon-2017-06-02-0742, HV-Megoo-Dumbot-2017-03-20-0832, HV-Dumbot-guest-2017-03-25-0020, HV-PainterBob-Dumbot-2017-03-26-1603, HV-Dumbot-radpaul7-2017-05-13-1312, HV-Dumbot-guest-2017-11-12-0321, HV-Dumbot-guest-2017-10-10-0012, HV-tongan-SmartBot-2017-10-06-0052, U!HV-Dumbot-TMarshal-2017-09-01-0007, U!HV-MacMac-seydel-2017-09-07-1336, HV-Dumbot-dimitrif-2018-04-09-1559, HV-caylus-Dumbot-2018-04-16-1952, HV-Jubal-SmartBot-2018-04-17-0337, HV-Dumbot-ZoneCold-2018-04-01-0548, HV-Dumbot-Cathaoir-2018-08-16-2318, HV-WeakBot-Cathaoir-2018-08-15-2303, HV-Dumbot-Cathaoir-2018-08-22-2204, HV-WeakBot-Cathaoir-2018-08-23-1830, HV-WeakBot-Cathaoir-2018-08-23-1831, HV-guest-WeakBot-2018-12-15-0241, U!HV-arrayking-Dumbot-2018-12-22-0456, U!HV-arrayking-Dumbot-2018-12-22-0554, U!HV-arrayking-Dumbot-2018-12-22-0901, HV-tongan-Dumbot-2018-02-20-0958, HV-antsac-Dumbot-2018-07-23-2352, HV-antsac-Dumbot-2018-07-24-0003, HV-shcrub-SmartBot-2018-07-24-1950, HV-WeakBot-guest-2018-07-24-1157, HV-Bogusz-WeakBot-2018-06-09-1318, HV-Bogusz-WeakBot-2018-06-09-1404, HV-WeakBot-idlebytes-2018-06-13-2121, HV-SmartBot-Peckhead-2018-03-15-1357, HV-SmartBot-Peckhead-2018-03-15-1453, HV-SmartBot-Peckhead-2018-03-16-0403, HV-Dumbot-mullenc4-2018-05-08-0318, HV-WeakBot-Abbo69-2018-11-04-1937, HV-Dumbot-guest-2018-09-14-0239, HV-Dumbot-Cathaoir-2018-08-30-2355, HV-Dumbot-Cathaoir-2018-08-31-2249, HV-Dumbot-gameshark9-2019-04-20-1430, HV-WeakBot-gcallari-2019-08-10-1911, HV-Dumbot-TirKen-2019-12-10-0922, HV-WeakBot-guest-2019-12-12-1720, U!HV-MasCo-WeakBot-2019-12-12-1220, HV-arrayking-Dumbot-2019-01-14-1056, HV-arrayking-WeakBot-2019-01-26-1246, HV-guest-SmartBot-2019-03-27-1128, HV-guest-WeakBot-2019-03-27-1137, HV-brimze-WeakBot-2019-05-12-0509, HV-jaykeen-Dumbot-2019-05-12-2351, HV-shturik-SmartBot-2019-05-20-1241, HV-Dumbot-joephes-2019-05-24-1005, HV-Zippy-Dumbot-2019-05-27-2233, U!HV-Forggotten-SmartBot-2019-05-26-1315, HV-WeakBot-Cathaoir-2019-05-02-1301, HV-WeakBot-veld-2019-05-02-0533, HV-WeakBot-veld-2019-05-02-1509, HV-WeakBot-veld-2019-05-03-0341, T!HV-Loizz-pillbugger-2019-05-07-1738, U!HV-guest-SmartBot-2019-05-06-1510, U!HV-MasCo-WeakBot-2019-11-16-1221, U!HV-MasCo-WeakBot-2019-11-16-2326, HV-MasCo-WeakBot-2019-11-21-1057, U!HV-MasCo-WeakBot-2019-11-23-0814, HV-MasCo-WeakBot-2019-11-05-1104, U!HV-WeakBot-ramotram-2019-10-07-0542, U!HV-WeakBot-ramotram-2019-10-07-2309, HV-WeakBot-guest-2019-10-15-1416, HV-MasCo-WeakBot-2019-10-19-0338, HV-WeakBot-Cathaoir-2019-10-27-0222, HV-WeakBot-Cathaoir-2019-10-27-0231, HV-WeakBot-Cathaoir-2019-10-27-0239, HV-WeakBot-guest-2019-10-05-1612, HV-WeakBot-guest-2019-09-19-1929, HV-Dumbot-guest-2019-09-21-0850, HV-SmartBot-guest-2019-09-21-1021, HV-SmartBot-guest-2019-09-28-0735, HV-SmartBot-guest-2019-09-28-1545, T!HV-Loizz-dube-2019-09-21-1634, HV-sirtadly-WeakBot-2019-09-02-1716, HV-chaos00-Dumbot1-2020-04-24-1802, HV-Dumbot0-TirJera-2020-02-09-0528, HV-C0l1nj4m3s-Dumbot-2020-01-19-0540, U!HV-2morrow-WeakBot-2020-01-04-1904, HV-WeakBot0-ssmmww-2020-06-10-1231, HV-SmartBot0-poundfist-2020-06-16-0020, HV-UNtMySpvsr-SmartBot1-2020-06-21-0234, HV-JagamhnDas-WeakBot1-2020-02-25-2355, "
wS1 - bL,https://entomology.appspot.com/hive.html?bg=0&color=1&grid=0&label=1&mode=edit&board=wS1-1+1bL-2+2&title=HV-BogdanM-Dumbot-2015-04-13-2019%20::%20N:309%20whitewin:3%25%20blackwin:7%25%20draw:90%25,309,8,2.588996763754045,23,7.44336569579288,278,89.96763754045307,"HV-amartinez-WeakBot1-2020-04-12-2204, T!HV-0Rose0-Mach3Racer-2020-04-20-1439, T!HV-CBerserker-hawk81-2020-04-23-0830, HV-WeakBot-UNtMySpvsr-2020-04-25-2143, HV-WeakBot-luko-2020-01-27-0738, HV-MacPhee-poundfist-2020-06-13-0340, HV-MacPhee-poundfist-2020-06-13-0350, HV-rizeagain-WeakBot1-2020-06-28-0253, ","HV-Wendi452-ringersoll-2020-04-12-2222, HV-WeakBot-UNtMySpvsr-2020-04-14-2210, HV-Gkobiec-Turkster-2020-04-20-1254, T!HV-0Rose0-Mach3Racer-2020-04-20-1415, HV-WeakBot0-guest-2020-04-22-2107, T!HV-Leoon08-Fredski-2020-04-22-1701, T!HV-pichu240-SIDOREMI-2020-04-22-0813, T!HV-pichu240-SIDOREMI-2020-04-22-0833, HV-lmartin-amartinez-2020-04-27-2104, HV-WeakBot-luko-2020-01-23-0802, HV-SmartBot0-TFro-2020-06-10-1434, HV-WeakBot0-rizeagain-2020-06-09-2319, T!HV-MaxShark-lambda22-2020-06-01-1556, HV-SmartBot0-UNtMySpvsr-2020-06-18-2302, HV-SmartBot-UNtMySpvsr-2020-06-20-0158, HV-Leoon08-RaiD-2020-05-15-1530, HV-Leoon08-RaiD-2020-05-15-1545, T!HV-RJH666-dodger-2020-05-16-1249, HV-Dumbot0-BoardinATL-2020-04-30-2343, TU!HV-Rufeo612-Turkster-2020-05-22-2026, HV-SmartBot-UNtMySpvsr-2020-05-26-0220, HV-SmartBot0-UNtMySpvsr-2020-05-27-2018, HV-Dumbot0-fbaumann-2020-05-02-0915, ","HV-BogdanM-Dumbot-2015-04-13-2019, HV-jew-Dumbot-2015-04-14-2257, HV-jew-ringersoll-2015-04-14-2300, U!HV-jrf715-Dumbot-2015-04-11-0316, HV-cibci-Dumbot-2015-04-17-1521, HV-Dumbot-jew-2015-04-20-0216, HV-GoGoMatrix-Dumbot-2015-04-20-0017, HV-guest-Dumbot-2015-04-16-1218, HV-jew-nevir-2015-04-19-1518, HV-jew-ringersoll-2015-04-18-2252, U!HV-TMarshal-Dumbot-2015-04-19-1734, U!HV-wmbekking-ringersoll-2015-04-19-1704, U!HV-TMarshal-Dumbot-2015-04-21-0201, U!HV-TMarshal-Dumbot-2015-04-23-1922, HV-Bechster-nevir-2015-04-27-0928, U!HV-Ataraxia-Dumbot-2015-04-24-0934, U!HV-TMarshal-Dumbot-2015-04-25-2339, U!HV-TMarshal-Dumbot-2015-04-26-1051, U!HV-daaphod-Dumbot-2015-04-01-0149, U!HV-guest-Dumbot-2015-04-02-1231, U!HV-guest-Dumbot-2015-04-02-2316, U!HV-TMarshal-Dumbot-2015-03-31-0141, HV-Shaia-Dumbot-2015-08-22-0527, HV-Dumbot-jew-2015-08-09-0025, HV-guest-Dumbot-2015-12-01-1509, HV-Dumbot-Bechster-2015-02-15-2043, U!HV-Bechster-nevir-2015-01-30-0910, HV-Dumbot-shogi-2015-02-24-1801, HV-Plodder24-Dumbot-2015-02-02-2102, HV-guest-Dumbot-2015-01-08-0516, HV-jrf715-Dumbot-2015-01-12-0411, HV-atdandy-Bechster-2015-01-16-1803, HV-atdandy-nevir-2015-01-16-1711, HV-atdandy-nevir-2015-01-16-1729, HV-atdandy-nevir-2015-01-16-2053, HV-atdandy-nevir-2015-01-16-2113, HV-ialba-Dumbot-2015-01-17-2254, HV-ialba-fabian-2015-01-17-2322, U!HV-Dumbot-nevir-2015-01-23-1904, HV-Bechster-nevir-2015-01-28-2029, HV-Mediaphag-Dumbot-2015-01-06-0820, HV-Dumbot-jew-2015-07-09-1557, HV-domantos-Dumbot-2015-07-18-2049, HV-guest-Dumbot-2015-07-19-1309, HV-Dumbot-shogi-2015-07-22-0031, HV-guest-Dumbot-2015-07-22-2145, HV-guest-Dumbot-2015-07-26-1949, HV-thales-Dumbot-2015-07-27-1954, HV-thales-Dumbot-2015-07-28-0643, HV-Dumbot-jew-2015-05-30-1809, HV-osnoca-nevir-2015-05-29-2030, HV-dodger-Dumbot-2015-06-10-1705, U!HV-TMarshal-Dumbot-2015-06-09-0209, U!HV-TMarshal-Dumbot-2015-06-11-0114, HV-Dumbot-esquire415-2015-06-13-0559, U!HV-TMarshal-Dumbot-2015-06-20-0348, HV-ryden-nevir-2015-06-23-0843, HV-ryden-nevir-2015-06-23-0851, U!HV-guest-Dumbot-2015-03-15-1230, U!HV-nbushfield-Dumbot-2015-03-15-2257, HV-cambokid17-Dumbot-2015-03-18-1844, HV-guest-Dumbot-2015-03-18-2138, HV-shogi-Dumbot-2015-03-24-1602, HV-BogdanM-Dumbot-2015-03-08-1306, U!HV-nbushfield-Dumbot-2015-03-08-0400, U!HV-nbushfield-Dumbot-2015-03-08-0512, U!HV-TMarshal-Dumbot-2015-05-07-0103, U!HV-TMarshal-Dumbot-2015-05-09-0210, HV-guest-Dumbot-2015-05-12-2307, HV-Shad3r-Dumbot-2015-05-14-0140, HV-Dumbot-jew-2015-05-18-2219, HV-Dumbot-fbaumann-2015-05-01-1022, HV-guest-nevir-2015-04-28-1448, U!HV-quasi-Dumbot-2015-05-03-1305, U!HV-TMarshal-Dumbot-2015-05-01-2249, U!HV-TMarshal-Dumbot-2015-05-02-2128, U!HV-isearch12-Dumbot-2015-10-11-1038, HV-Plask-Dumbot-2015-10-19-1116, HV-guest-Dumbot-2015-10-02-1957, HV-bertuccia-Dumbot-2015-09-24-1917, HV-Dumbot-tanksc-2015-09-25-0552, HV-jrf715-Dumbot-2015-09-27-0516, U!HV-allahakbar-Dumbot-2015-09-23-0618, U!HV-Bertuccia-Dumbot-2015-09-23-1102, U!HV-guest-Dumbot-2015-09-24-1307, U!HV-guest-Dumbot-2015-09-24-1501, HV-Nuno-Dumbot-2015-09-06-1828, HV-Shaia-Dumbot-2015-08-28-1931, HV-ropryz-Dumbot-2016-04-07-2226, HV-Dumbot-jewdoka-2016-04-22-0248, HV-guest-Dumbot-2016-03-29-2041, U!HV-JM3000-Dumbot-0-01-00-0000, U!HV-TMarshal-ringersoll-2016-08-25-0053, HV-Dumbot-Quodlibet-2016-01-30-2136, HV-guest-Dumbot-2016-01-13-1125, HV-kdladage-Dumbot-2016-01-05-1325, HV-dumbledore-ringersoll-2016-01-23-1401, T!HV-dragonlord-bitsofgreg-2016-06-23-1801, HV-dragonlord-andypie-2016-06-05-1719, HV-Dumbot-Cyrax-2016-06-02-1100, T!HV-dragonlord-Quodlibet-2016-06-03-1937, HV-blue1224-Dumbot-2016-03-08-0236, HV-Bechster-nevir-2016-03-24-2033, HV-Dumbot-nevir-2016-03-25-0548, HV-dragonlord-nevir-2016-05-10-2100, HV-triplefool-Dumbot-2016-05-09-0432, HV-dragonlord-ringersoll-2016-05-14-1215, T!HV-dragonlord-gabri-2016-05-15-2109, HV-194-Bodacity-2016-05-24-1830, U!HV-asabez-Dumbot-2016-05-21-1814, U!HV-gannondf-nevir-2016-05-05-0221, U!HV-gannondf-ringersoll-2016-05-05-0016, HV-ugly-Dumbot-2016-11-22-2029, HV-Eucalyx-Jewdoka-2016-11-06-0057, HV-Montty-ringersoll-2016-09-08-2227, U!HV-TMarshal-Dumbot-2016-09-10-2257, U!HV-TMarshal-Dumbot-2016-09-11-0203, HV-guest-Dumbot-2016-08-29-1819, U!HV-TMarshal-Dumbot-2016-08-27-0402, U!HV-guest-Dumbot-2017-04-10-2200, T!HV-BogdanM-Bechster-2017-04-21-1432, HV-Dumbot-guest-2017-04-28-0051, HV-gabrieleud-Dube-2017-04-07-2056, U!HV-TMarshal-Dumbot-2017-08-06-2147, U!HV-TMarshal-Dumbot-2017-08-14-1641, U!HV-TMarshal-Dumbot-2017-08-17-1156, U!HV-TMarshal-Dumbot-2017-08-19-0219, HV-Dumbot-Guybrush-2017-07-29-0556, U!HV-TMarshal-Dumbot-2017-07-30-2301, HV-guest-Dumbot-2016-12-29-1847, HV-guest-Dumbot-2016-12-30-1443, HV-guest-Dumbot-2017-07-06-2123, T!HV-lambda22-stepanzo-2017-07-07-0330, U!HV-TMarshal-Dumbot-2017-07-07-2319, U!HV-TMarshal-Dumbot-2017-07-09-1848, U!HV-TMarshal-Dumbot-2017-07-13-1513, U!HV-TMarshal-Dumbot-2017-07-15-1421, U!HV-TMarshal-Dumbot-2017-07-20-1447, U!HV-TMarshal-Dumbot-2017-07-24-2143, HV-tangarang-Dube-2017-06-05-0312, HV-jubal-Dube-2017-03-22-0440, HV-dragonlord-ringersoll-2017-03-26-1934, HV-guest-Dumbot-2017-03-24-1900, HV-Dumbot-Felixavier-2017-05-10-1835, HV-Dumbot-jubal-2017-05-19-0252, HV-Dumbot-prai0006-2017-05-17-1729, T!HV-beeman000-16mk16-2017-05-19-1720, U!HV-SmartBot-stepanzo-2017-05-25-0304, HV-c4nnes-rchipman-2017-05-01-2129, U!HV-JTmoney-Dumbot-2017-05-28-0137, HV-CSS7806-Dumbot-2017-05-04-1406, HV-dacajun-flysuppo-2017-05-06-0729, HV-guest-Dumbot-2017-11-13-1933, HV-SmartBot-nevir-2017-10-09-1219, HV-guest-SmartBot-2017-10-26-0040, HV-Dumbot-nevir-2017-09-26-1525, U!HV-seydel-MacMac-2017-10-04-1510, HV-Nemo22-Gandac-2018-03-30-0819, HV-SmartBot-guest-2018-04-11-1009, U!HV-Dumbot-guest-2018-04-12-0628, HV-truep-Dumbot-2018-04-16-0333, T!HV-sullamen-Frasco92-2018-04-19-2112, T!HV-Makajawan-Gandac-2018-04-21-1927, U!HV-Dumbot-convidado1497-2018-04-04-2055, HV-guest-SmartBot-2018-04-08-0043, HV-Cathaoir-WeakBot-2018-08-13-2301, HV-Cathaoir-Dumbot-2018-08-18-0711, HV-Cathaoir-WeakBot-2018-08-16-1615, HV-Cathaoir-WeakBot-2018-08-17-2130, HV-zhuangzi-dimitrif-2018-08-15-1626, HV-SmartBot-neighlles-2018-08-03-1454, HV-guest-guest-2018-12-08-1352, HV-kekov-WeakBot-2018-11-27-1326, U!HV-arrayking-Dumbot-2018-12-22-0156, U!HV-arrayking-Dumbot-2018-12-22-0222, U!HV-WeakBot-guest-2018-12-24-2054, HV-Dumbledore-Dumbot-2018-02-14-2335, HV-Dumbot-guest-2018-02-19-1937, HV-Dumbot-neighlles-2018-07-15-0038, HV-SmartBot-neighlles-2018-07-12-0402, HV-dimitrif-Dumbot-2018-07-17-1040, HV-dimitrif-Dumbot-2018-07-18-1603, HV-guest-WeakBot-2018-07-16-1749, HV-badhairday-Dumbot-2018-07-22-1938, HV-guest-Dumbot-2018-07-27-0333, HV-zhuangzi-dimitrif-2018-07-25-1419, HV-WeakBot-guest-2018-07-02-2058, HV-WeakBot-neighlles-2018-06-30-0143, HV-idlebytes-WeakBot-2018-06-14-0133, HV-guest-Dumbot-2018-06-15-0038, HV-Dumbot-neighlles-2018-06-22-2354, HV-WeakBot-jsotelo-2018-06-22-1840, HV-SmartBot-Radek0-2018-06-26-1712, HV-Nemo22-Chrometal-2018-06-06-1053, HV-Peckhead-SmartBot-2018-03-14-0329, HV-Peckhead-SmartBot-2018-03-19-1206, HV-poopgoose-lizzzzzzz-2018-03-17-2040, HV-poopgoose-lizzzzzzz-2018-03-17-2332, U!HV-TMarshal-Dumbot-2018-03-18-0134, HV-Peckhead-saltylick-2018-03-24-0356, HV-Dumbot-neighlles-2018-05-12-1816, HV-Dumbot-neighlles-2018-05-13-0107, HV-makajawan1-alphasg-2018-05-13-1150, HV-Nemo22-Chrometal-2018-05-10-1241, HV-xrisponi-ruthhive-2018-05-10-2148, HV-CBerserker-P3r-2018-05-15-0851, HV-mullenc4-Dumbot-2018-05-15-0211, HV-Dumbot-fbaumann-2018-05-20-2044, HV-xrisponi-fbaumann-2018-05-20-1815, T!HV-CBerserker-Ssadnicki-2018-05-27-1922, U!HV-TMarshal-Dumbot-2018-05-28-1657, U!HV-WeakBot-guest-2018-11-09-1357, HV-Abbo69-WeakBot-2018-10-28-2007, U!HV-Abbo69-WeakBot-2018-11-01-1918, U!HV-WeakBot-guest-2018-10-15-1331, U!HV-WeakBot-guest-2018-10-16-0840, U!HV-WeakBot-guest-2018-10-17-1517, HV-reilisam-saltylick-2018-09-14-0125, HV-reilisam-WeakBot-2018-09-14-0056, HV-Cathaoir-Dumbot-2018-08-30-2051, HV-dimitrif-Dumbot-2018-09-01-1353, HV-Dumbot-axljka-2019-04-14-1816, HV-WeakBot-Forggotten-2019-04-12-1405, HV-Dumbot-GFLima-2019-04-23-0412, T!HV-eyelost-Gandac-2019-04-25-0901, U!HV-guest-WeakBot-2019-12-09-0715, U!HV-guest-WeakBot-2019-12-11-0650, U!HV-guest-WeakBot-2019-12-11-0653, HV-radamsuo16-saltylick-2019-12-21-0632, HV-WeakBot-guest-2019-12-20-0951, HV-TirKen-saltylick-2019-12-02-0517, HV-WeakBot-GoodGuyTim-2019-11-28-1446, U!HV-guest-WeakBot-2019-12-03-0709, HV-bonbon-WeakBot-2019-02-18-0711, HV-guest-saltylick-2019-02-20-1545, U!HV-WeakBot-guest-2019-01-06-1251, HV-Cathaoir-WeakBot-2019-07-26-0139, T!HV-eyelost-shturik-2019-06-06-1311, T!HV-eyelost-axljka-2019-06-19-0858, HV-WeakBot-jultou-2019-03-27-2312, U!HV-SmartBot-guest-2019-03-27-1401, HV-jaykeen-ringersoll-2019-05-11-1422, HV-jaykeen-ringersoll-2019-05-11-1441, HV-heisenbeg6-ringersoll-2019-05-12-2158, HV-jaykeen-Dumbot-2019-05-13-0428, U!HV-veld-WeakBot-2019-05-01-2010, HV-SmartBot-shturik-2019-05-20-0949, HV-BogdanM-apolloq-2019-05-26-1825, T!HV-MaxShark-apolloq-2019-05-29-1738, T!HV-pillbugger-gameshark9-2019-05-26-2255, T!HV-eyelost-Jewdoka-2019-05-03-1250, HV-guest-Dumbot-2019-11-09-1205, HV-Dumbot-saltylick-2019-11-05-0618, HV-guest-WeakBot-2019-10-15-1420, HV-guest-WeakBot-2019-10-15-1425, HV-guest-WeakBot-2019-10-15-1450, HV-guest-WeakBot-2019-10-15-1459, HV-guest-SmartBot-2019-09-29-0827, HV-guest-WeakBot-2019-10-06-1716, HV-WeakBot-Trogon64-2019-09-09-1724, HV-guest-SmartBot-2019-09-20-0922, HV-guest-SmartBot-2019-09-21-0837, HV-guest-SmartBot-2019-09-25-1846, HV-guest-SmartBot-2019-09-28-0748, T!HV-Loizz-Quodlibet-2019-09-01-1648, HV-amartinez-WeakBot1-2020-04-11-2351, HV-SmartBot0-BoardinATL-2020-04-15-0309, HV-WeakBot0-UNtMySpvsr-2020-04-16-0252, HV-WeakBot0-bravado24-2020-04-25-0215, HV-Dumbot0-BoardinATL-2020-04-27-1807, HV-dsheikhp-Dumbot1-2020-02-07-0652, HV-guest-WeakBot-2020-01-10-0424, HV-SmartBot-guest-2020-01-13-1739, HV-Yanks46-SmartBot1-2020-06-22-1554, HV-Wendi452-WeakBot1-2020-03-12-0253, HV-WeakBot0-luko-2020-03-19-0943, HV-Rufeo612-WeakBot1-2020-05-10-1322, HV-SmartBot-UNtMySpvsr-2020-05-27-0127, "
