Game Type:,Hive-PLM
TotNrGames:,9098
Opening name, Entomology URL, Total nr of games, Nr white wins, White win percentage, Nr black wins, Black win percentage, Nr draws, Draw percentage, List of white win games, List of black win games, List of drawn games
wS1 - bA1,https://entomology.appspot.com/hive.html?bg=0&color=1&grid=0&label=1&mode=edit&board=bA1-1+1wS1+0+0&title=HV-Bechster-Dumbot-2015-04-10-1811%20::%20N:157%20whitewin:6%25%20blackwin:2%25%20draw:92%25,157,10,6.369426751592357,3,1.910828025477707,144,91.71974522292993,"HV-HautRoi-Meowtastic-2020-04-06-1705, HV-skewedleft-WeakBot1-2020-04-03-0141, HV-lmartin-WeakBot1-2020-04-19-2122, HV-amartinez-WeakBot1-2020-04-25-2148, HV-guest-SmartBot1-2020-04-26-1737, HV-guest-guest-2020-06-07-0902, HV-Wendi452-WeakBot1-2020-03-08-1629, U!HV-Beewolf87-Dumbot1-2020-03-03-1023, HV-Rufeo612-WeakBot1-2020-05-14-1758, HV-Rufeo612-WeakBot1-2020-05-05-2105, ","HV-SmartBot0-poundfist-2020-06-17-0209, HV-mcd4wvu-WeakBot-2020-02-27-1344, HV-Yanks46-WeakBot-2020-06-27-1204, ","HV-Bechster-Dumbot-2015-04-10-1811, U!HV-TMarshal-Dumbot-2015-04-09-1326, U!HV-guest-Dumbot-2015-04-11-0927, HV-wmbekking-Dumbot-2015-04-19-1738, U!HV-TMarshal-Dumbot-2015-04-18-1905, U!HV-TMarshal-Dumbot-2015-04-28-0132, HV-Dumbot-nevir-2015-04-01-1832, U!HV-guest-Dumbot-2015-04-02-2351, U!HV-Screamer-nevir-2015-04-03-1922, U!HV-guest-Dumbot-2015-04-06-0647, U!HV-heartmind-Dumbot-2015-04-07-0033, U!HV-guest-Dumbot-2015-08-04-0015, HV-fritfrat-Alanna5-2015-02-21-0020, HV-Quro-Dumbot-2015-01-06-0900, HV-guest-Dumbot-2015-07-12-1930, HV-guest-Dumbot-2015-07-12-2225, HV-guest-Dumbot-2015-07-14-2152, U!HV-guest-Dumbot-2015-07-13-2335, HV-domantos-Dumbot-2015-07-18-2126, U!HV-TMarshal-Dumbot-2015-07-19-1335, HV-Zurround-ryden-2015-06-22-1652, HV-ryden-Dumbot-2015-06-23-0816, HV-Dumbot-nevir-2015-03-11-1913, HV-jrf715-Dumbot-2015-03-23-0236, HV-guest-Dumbot-2015-04-30-2230, U!HV-TMarshal-Dumbot-2015-05-02-0307, U!HV-TMarshal-Dumbot-2015-05-04-0025, U!HV-TMarshal-Dumbot-2015-10-11-0430, U!HV-TMarshal-Dumbot-2015-09-08-1955, U!HV-TMarshal-Dumbot-2015-09-12-1836, U!HV-DDonskoy-Dumbot-2015-09-17-1543, HV-Bertuccia-Dumbot-2015-09-23-2140, HV-guest-Dumbot-2015-09-06-2110, U!HV-ci00rix-Dumbot-2016-04-14-1748, HV-blue1224-Dumbot-2016-04-02-1915, U!HV-ropryz-Dumbot-2016-04-01-0255, U!HV-TMarshal-Dumbot-2016-08-24-2058, U!HV-TMarshal-Dumbot-2016-08-24-2200, HV-higgsi-Dumbot-2016-02-13-0943, HV-Dumbot-KDLadage-2016-01-03-0215, HV-jrf715-Dumbot-2016-01-10-0630, HV-kdladage-Dumbot-2016-01-07-2156, HV-smatt-Dumbot-2016-01-01-1703, HV-SamjimG-Dumbot-2016-03-10-2246, HV-northman-Dumbot-2016-03-26-1701, HV-umokden-Dumbot-2016-09-03-1918, HV-Wdzydze-Dumbot-2017-04-18-1643, HV-avila-Dumbot-2017-04-20-1723, HV-BogdanM-Dumbot-2017-04-20-0432, U!HV-TMarshal-Dumbot-2017-08-03-1704, U!HV-TMarshal-Dumbot-2017-08-05-1700, U!HV-TMarshal-Dumbot-2017-08-15-1819, U!HV-TMarshal-Dumbot-2017-08-16-1046, U!HV-TMarshal-Dumbot-2017-08-18-1536, U!HV-TMarshal-Dumbot-2017-08-02-0208, HV-Axlia-Dumbot-2017-02-26-1804, HV-guest-Dumbot-2016-12-30-1733, U!HV-TMarshal-Dumbot-2017-07-10-2038, U!HV-TMarshal-Dumbot-2017-07-11-0041, U!HV-TMarshal-Dumbot-2017-07-11-0132, U!HV-TMarshal-Dumbot-2017-07-11-1738, U!HV-TMarshal-Dumbot-2017-07-11-2128, U!HV-TMarshal-Dumbot-2017-07-13-2225, U!HV-TMarshal-Dumbot-2017-07-14-1553, U!HV-TMarshal-Dumbot-2017-07-14-2214, U!HV-TMarshal-Dumbot-2017-07-16-2111, U!HV-TMarshal-Dumbot-2017-07-23-0143, U!HV-TMarshal-Dumbot-2017-07-25-0135, U!HV-TMarshal-Dumbot-2017-07-27-2253, HV-guest-Dumbot-2017-03-24-1537, HV-guest-Dumbot-2017-03-25-2045, HV-guest-Dumbot-2017-03-26-0134, HV-gmoney-Dumbot-2017-11-15-0349, U!HV-guest-Dumbot-2017-10-15-1841, U!HV-guest-Dumbot-2017-10-15-1856, HV-TMarshal-Dumbot-2017-09-29-0445, U!HV-Dumbot-SMG-2017-10-01-0129, HV-seydel-MacMac-2017-09-09-1933, HV-chyaya-Dumbot-2017-09-15-1240, HV-lexxy777-SmartBot-2017-09-15-1313, HV-TMarshal-Dumbot-2017-09-14-2116, U!HV-lexxy777-SmartBot-2017-09-14-0714, U!HV-guest-Dumbot-2017-09-07-1419, U!HV-TMarshal-Dumbot-2017-09-06-1952, HV-guest-SmartBot-2018-04-02-0105, HV-riptide-Dumbot-2018-04-05-0035, HV-Cathaoir-WeakBot-2018-08-12-0049, HV-Cathaoir-WeakBot-2018-08-13-1940, HV-Cathaoir-Dumbot-2018-08-16-2348, HV-Cathaoir-WeakBot-2018-08-15-2152, HV-Cathaoir-WeakBot-2018-08-15-2206, HV-HornyToad-WeakBot-2018-08-22-0851, U!HV-Pesqueta-WeakBot-2018-08-03-2329, HV-mejiaff-WeakBot-2018-12-13-1957, U!HV-arrayking-Dumbot-2018-12-22-0110, HV-guest-Dumbot-2018-02-19-1954, HV-dimitrif-Dumbot-2018-07-18-1619, HV-dimitrif-Dumbot-2018-07-25-1513, HV-dimitrif-Dumbot-2018-07-26-1651, HV-dimitrif-Dumbot-2018-07-27-1905, HV-JerkSiPei-Dumbot-2018-06-16-1648, HV-Peckhead-SmartBot-2018-03-12-1051, HV-Peckhead-SmartBot-2018-03-15-1545, HV-Peckhead-SmartBot-2018-03-16-0437, HV-lizzzzzzz-SmartBot-2018-03-19-0207, U!HV-teok-Dumbot-2018-03-23-2128, HV-smatt-SmartBot-2018-05-06-1851, HV-cjohnson-Dumbot-2018-05-11-1538, HV-BvdB1989-WeakBot-2018-05-19-1452, HV-BvdB1989-WeakBot-2018-05-19-2033, HV-guest-WeakBot-2018-05-28-1326, HV-kekov-SmartBot-2018-11-16-2315, HV-dimitrif-zhuangzi-2018-09-07-1742, U!HV-TMarshal-Dumbot-2018-09-15-1215, HV-SmartBot-lamsingyiu-2019-04-23-1619, HV-guest-WeakBot-2019-12-10-1523, U!HV-guest-WeakBot-2019-12-03-0730, U!HV-guest-WeakBot-2019-12-07-1828, U!HV-Polovinkin-Dumbot-2019-07-24-1058, HV-yurijvp-Dumbot-2019-06-11-0610, HV-guest-codyhold12-2019-06-18-0311, HV-Dumbot-dmlyrae-2019-06-21-0717, U!HV-Pirisha-WeakBot-2019-06-20-1711, HV-MaxShark-shturik-2019-03-20-1910, HV-jaykeen-Dumbot-2019-05-13-0355, HV-jaykeen-Dumbot-2019-05-13-0413, HV-Zippy-SmartBot-2019-05-20-2345, HV-Dumbot-Tokyo27-2019-05-02-1400, U!HV-Mooregp12-WeakBot-2019-11-15-1408, HV-guest-WeakBot-2019-11-07-1103, HV-guest-WeakBot-2019-10-09-0951, HV-guest-WeakBot-2019-10-09-1004, HV-guest-Dumbot-2019-09-19-1629, HV-guest-SmartBot-2019-09-20-1416, HV-guest-Dumbot-2019-09-21-0549, HV-guest-SmartBot-2019-09-22-1248, HV-guest-SmartBot-2019-09-22-1657, U!HV-guest-SmartBot-2019-09-22-0922, HV-candimanf-WeakBot1-2020-04-24-2338, HV-guest-WeakBot-2020-01-17-0441, HV-Rufeo612-WeakBot-2020-05-14-1119, U!HV-Jocalu-WeakBot1-2020-04-30-1300, HV-radamsuo16-WeakBot1-2020-07-06-2240, HV-Specialist-WeakBot1-2020-07-06-1333, "
wS1 - bG1,https://entomology.appspot.com/hive.html?bg=0&color=1&grid=0&label=1&mode=edit&board=wS1+0+0bG1-1+1&title=HV-ChuckBeard-Dumbot-2015-04-08-1207%20::%20N:261%20whitewin:2%25%20blackwin:3%25%20draw:95%25,261,5,1.9157088122605364,7,2.681992337164751,249,95.40229885057471,"HV-chaos00-WeakBot1-2020-04-22-0610, U!HV-guest-WeakBot1-2020-03-17-1223, T!HV-Adzee26-Ssadnicki-2020-05-05-1458, HV-rizeagain-WeakBot1-2020-06-28-0122, HV-Yanks46-WeakBot-2020-06-27-2233, ","HV-omiomio-andyy-2020-03-28-0355, HV-HautRoi-Meowtastic-2020-04-06-1651, HV-mcd4wvu-WeakBot-2020-03-08-0047, HV-mcd4wvu-WeakBot-2020-02-28-0238, HV-WeakBot0-guest-2020-05-27-1746, T!HV-Adzee26-Ssadnicki-2020-05-05-1525, T!HV-Adzee26-Ssadnicki-2020-05-08-1525, ","HV-ChuckBeard-Dumbot-2015-04-08-1207, HV-Dumbot-kdladage-2015-04-10-0523, HV-Dumbot-preve-2015-04-07-2153, HV-Dumbot-howl-2015-04-12-1829, HV-cibci-Dumbot-2015-04-16-1900, HV-guest-Dumbot-2015-04-17-1021, HV-guest-Dumbot-2015-04-17-1631, U!HV-TMarshal-Dumbot-2015-04-18-1455, U!HV-TMarshal-Dumbot-2015-04-22-0203, U!HV-TMarshal-Dumbot-2015-04-24-2153, U!HV-TMarshal-Dumbot-2015-04-25-2000, U!HV-TMarshal-Dumbot-2015-04-25-2149, U!HV-guest-Dumbot-2015-04-03-0002, U!HV-TMarshal-Dumbot-2015-04-06-1153, HV-billhall69-Dumbot-2015-08-09-1811, HV-guest-Dumbot-2015-08-16-0834, HV-isearch12-Dumbot-2015-08-12-2234, HV-rogerp-Dumbot-2015-08-23-2133, HV-mirthmatte-Dumbot-2015-07-31-0820, HV-Dumbot-bof-2015-12-16-2133, HV-guest-Dumbot-2015-11-30-1728, HV-pcpr80-Dumbot-2015-02-03-1547, U!HV-guest-Dumbot-2015-01-26-1636, HV-Zacile-Subjekt-2015-07-09-0531, HV-domantos-Dumbot-2015-07-17-2129, HV-Zacile-Subjekt-2015-07-13-0400, U!HV-TMarshal-Dumbot-2015-07-17-2025, U!HV-TMarshal-Dumbot-2015-06-09-0137, U!HV-TMarshal-Dumbot-2015-06-13-0218, U!HV-TMarshal-Dumbot-2015-06-14-0413, U!HV-mirthmatte-Dumbot-2015-06-17-2004, U!HV-TMarshal-Dumbot-2015-06-21-0044, HV-ryden-Dumbot-2015-06-23-0822, HV-shogi-Dumbot-2015-03-24-0129, HV-Pandit-nevir-2015-03-26-2241, U!HV-TMarshal-Dumbot-2015-05-05-1359, HV-Shad3r-Dumbot-2015-05-14-1505, U!HV-guest-Dumbot-2015-05-14-0053, HV-TMarshal-Dumbot-2015-05-18-1307, HV-TMarshal-Dumbot-2015-05-23-0237, HV-Dumbot-preve-2015-05-01-1615, HV-TMarshal-Dumbot-2015-05-04-1714, U!HV-TMarshal-Dumbot-2015-04-28-2315, U!HV-TMarshal-Dumbot-2015-04-30-0249, U!HV-TMarshal-Dumbot-2015-05-05-0114, HV-Dumbot-bof-2015-11-23-2002, HV-jrf715-Dumbot-2015-09-30-0558, HV-Dumbot-guest-2015-09-20-1835, HV-Dumbot-Cyrax-2016-04-24-0855, U!HV-TMarshal-Dumbot-2016-08-21-2328, U!HV-TMarshal-Dumbot-2016-08-24-2003, HV-Dumbot-piens-2016-07-27-0527, HV-Dumbot-piens-2016-07-28-0307, HV-piens-Dumbot-2016-07-30-0624, HV-guest-Dumbot-2016-12-06-1540, HV-vonsohn-Dumbot-2016-02-12-2336, HV-ddd1067-Dumbot-2016-01-09-1827, HV-ddd1067-Dumbot-2016-01-09-1934, HV-dumbledore-Dumbot-2015-12-23-1155, HV-Dumbot-guest-2016-01-03-0304, HV-Dumbot-guest-2016-01-04-2305, HV-Dumbot-guest-2016-01-07-2243, HV-enoteco-Dumbot-2016-01-05-1935, HV-guest-guest-2015-12-24-0007, HV-guest-guest-2015-12-24-0019, U!HV-jrf715-Dumbot-2016-01-17-0015, HV-piens-Dumbot-2016-07-24-0506, U!HV-Eucalyx-lambda22-2016-07-03-0242, HV-Dumbot-Tiablo-2016-06-23-2218, HV-mrcndrpqn-Dumbot-2016-06-25-0159, HV-dragonlord-Dumbot-2016-06-06-1357, HV-Guest-Dumbot-2016-03-13-0841, HV-guest-Dumbot-2016-03-25-0145, HV-MLaF297-Dumbot-2016-03-26-0139, HV-Bodacity-Cyrax-2016-05-13-1450, HV-Bodacity-Cyrax-2016-05-13-1513, HV-dragonlord-roguesix-2016-05-09-2059, HV-dragonlord-titi91-2016-05-09-2045, HV-dragonlord-titi91-2016-05-09-2055, HV-Dumbot-barmaley-2016-05-12-1757, HV-gannondf-titi91-2016-05-09-2123, HV-dragonlord-Bodacity-2016-05-16-2135, HV-dragonlord-Phoenixian-2016-05-14-1709, HV-guest-cyrax-2016-05-21-1429, HV-guest-Cyrax-2016-05-22-2102, U!HV-Dumbot-RoXar-2016-04-26-1332, HV-gannondf-RoXar-2016-05-06-1302, HV-guest-Dumbot-2016-10-14-1702, HV-Dumbot-Frasco92-2016-09-22-1641, HV-Dumbot-Loizz-2017-04-08-0947, U!HV-guest-ddyer-2017-04-08-2014, HV-Dumbot-bpalermo-2017-04-14-2257, HV-Wdzydze-Loizz-2017-04-18-1722, HV-Dumbot-HappyKiwi-2017-04-19-2332, T!HV-beeman000-nevir-2017-04-19-1649, HV-bpalermo-Dumbot-2017-04-25-1939, T!HV-beeman000-Felixavier-2017-04-24-1516, HV-Dumbot-jubal-2017-04-02-0453, HV-Dumbot-tzimarou-2017-04-07-2209, HV-t1M0t8yk-Dumbot-2017-04-07-2114, U!HV-TMarshal-Dumbot-2017-08-14-1733, U!HV-TMarshal-Dumbot-2017-08-20-1656, U!HV-TMarshal-Dumbot-2017-07-31-1906, HV-Dumbledore-Dumbot-2017-12-23-0645, HV-Dumbot-Cyrax-2017-12-03-1050, HV-Dumbot-nevir-2017-11-28-1656, HV-Cliffy73-Dumbot-2017-02-17-1930, U!HV-Br0keAngel-brandedg-2017-01-22-0522, HV-Ferr-Dumbot-2017-01-02-1737, HV-Dumbot-Cyrax-2017-06-29-0943, U!HV-guest-guest-2017-07-06-1757, U!HV-TMarshal-Dumbot-2017-07-07-2240, U!HV-TMarshal-Dumbot-2017-07-08-2218, U!HV-guest-Dumbot-2017-07-14-1427, U!HV-TMarshal-Dumbot-2017-07-13-1351, U!HV-TMarshal-Dumbot-2017-07-13-1440, U!HV-TMarshal-Dumbot-2017-07-17-1006, U!HV-TMarshal-Dumbot-2017-07-17-2046, U!HV-TMarshal-Dumbot-2017-07-22-1050, HV-Dumbot-guest-2017-06-12-1003, HV-teilon-Dumbot-2017-06-14-0534, HV-SmartBot-tongan-2017-06-15-1255, HV-teilon-tanksc-2017-06-23-0741, HV-Dumbot-guest-2017-03-09-2228, HV-jubal-Dumbot-2017-03-11-0058, HV-jubal-Dumbot-2017-03-20-0345, HV-Dumbot-titi91-2017-03-24-1110, HV-guest-Dumbot-2017-03-26-2203, HV-guest-Dumbot-2017-03-27-2216, HV-BogdanM-t1M0t8yk-2017-04-29-1943, HV-dragonlord-HappyKiwi-2017-04-30-2301, U!HV-Dumbot-Loizz-2017-05-15-1807, U!HV-Dumbot-Loizz-2017-05-15-2231, U!HV-Dumbot-Loizz-2017-05-16-0850, HV-dodger-SmartBot-2017-05-22-1602, HV-Dumbot-Cyrax-2017-05-26-1040, HV-dacajun-flysuppo-2017-05-06-0733, HV-SmartBot-alibert-2017-11-21-1405, HV-howdydodat-chopsticks-2017-11-06-0011, HV-howdydodat-chopsticks-2017-11-07-2353, HV-TMarshal-Dumbot-2017-09-29-0426, U!HV-TMarshal-Dumbot-2017-09-03-1759, U!HV-TMarshal-Dumbot-2017-09-04-1107, HV-Dumbot-ZoneCold-2018-04-13-0848, HV-Dumbot-mdp-2018-04-19-1132, T!HV-BadWolf79-CBerserker-2018-04-17-0633, HV-Dumbot-ZoneCold-2018-04-24-0937, HV-Dumbot-ZoneCold-2018-04-25-0949, HV-SmartBot-guest-2018-04-02-0240, HV-Nemo22-Gandac-2018-04-05-1513, HV-SmartBot-guest-2018-04-04-0258, HV-Dumbot-ZoneCold-2018-04-08-0125, HV-SmartBot-Jubal-2018-04-09-0045, HV-Cathaoir-WeakBot-2018-08-12-0123, HV-Cathaoir-Dumbot-2018-08-18-0735, HV-Cathaoir-WeakBot-2018-08-19-0041, HV-Dumbot-neighlles-2018-08-04-0412, HV-Dumbot-neighlles-2018-08-05-1824, HV-SmartBot-smatt-2018-08-01-2320, HV-WeakBot-kekovv-2018-11-30-0148, U!HV-guest-WeakBot-2018-12-27-1359, HV-ZoneCold-Dumbot-2018-02-24-0320, HV-Dumbot-nevir-2018-01-15-0654, HV-Dumbledore-Dumbot-2018-01-19-0757, HV-usdrtoddaf-Dumbot-2018-01-25-2300, HV-Dumbot-neighlles-2018-07-18-1440, HV-WeakBot-ZoneCold-2018-07-23-0820, HV-Dumbot-neighlles-2018-07-26-1511, HV-smatt-SmartBot-2018-07-24-2218, HV-idlebytes-WeakBot-2018-06-14-0132, HV-guest1472-Dumbot-2018-06-16-0025, HV-HollyPirat-nevir-2018-06-18-1715, HV-WeakBot-Entropix-2018-06-24-1845, HV-Dumbot-nevir-2018-03-14-0931, HV-Peckhead-SmartBot-2018-03-14-0431, HV-Peckhead-SmartBot-2018-03-15-1534, HV-Peckhead-SmartBot-2018-03-16-0351, HV-dragonlord-jfs489-2018-03-17-1715, HV-guest-Chrometal-2018-03-17-1409, HV-poopgoose-lizzzzzzz-2018-03-17-2337, HV-poopgoose-lizzzzzzz-2018-03-17-2354, HV-lizzzzzzz-poopgoose-2018-03-21-2232, HV-rbarratt-ddyer-2018-03-25-2311, T!HV-c4nnes-nevir-2018-04-27-2030, T!HV-Jubal-Chrometal-2018-05-12-1901, HV-guest1498-WeakBot-2018-05-17-0333, HV-smatt-SmartBot-2018-05-24-0148, HV-guest-WeakBot-2018-05-28-0228, HV-CBerserker-Mcbeup-2018-05-03-1704, HV-kekovv-SmartBot-2018-11-18-1704, HV-SmartBot-kekovv-2018-11-18-0323, HV-SmartBot-kekovv-2018-11-25-1600, HV-WeakBot-Abbo69-2018-10-17-1237, HV-Dumbot-Abbo69-2018-10-04-2142, HV-WeakBot-Abbo69-2018-10-06-1353, HV-WeakBot-dispatcher-2018-09-08-1915, HV-Dumbot-guest-2019-04-11-1435, HV-OL1-Dumbot-2019-04-12-1709, HV-WeakBot-guest-2019-04-24-0922, T!HV-lamsingyiu-HappyKiwi-2019-04-25-1431, HV-WeakBot-Marko60-2019-04-03-2120, HV-guest-WeakBot-2019-12-23-0625, HV-radamsuo16-WeakBot-2019-12-07-0638, U!HV-guest-WeakBot-2019-12-08-1550, U!HV-guest-WeakBot-2019-12-09-0047, HV-imipolexg-guest-2019-01-06-1347, U!HV-imipolexg-guest-2019-01-06-1443, HV-WeakBot-guest-2019-01-13-0218, HV-Weismayr-WeakBot-2019-07-08-1451, HV-Cathaoir-WeakBot-2019-07-05-1333, HV-SmartBot-guest-2019-06-09-1253, U!HV-WeakBot-voidwalker-2019-06-22-2308, HV-Dumbot-GFLima-2019-05-10-2256, HV-Zippy-WeakBot-2019-05-13-2057, HV-jrf715-WeakBot-2019-05-19-0244, T!HV-MaxShark-nevir-2019-05-20-2020, HV-Dumbot-GFLima-2019-05-08-0625, HV-Dumbot-preztrump-2019-05-08-0440, U!HV-Mooregp12-WeakBot-2019-11-15-1357, HV-Cathaoir-WeakBot-2019-11-19-1646, HV-WeakBot-Figsy81-2019-11-21-2320, U!HV-guest-Dumbot-2019-11-22-1754, HV-guest-WeakBot-2019-10-15-1437, HV-WeakBot-MasCo-2019-10-13-1051, HV-WeakBot-MasCo-2019-10-15-1246, HV-WeakBot-MasCo-2019-10-16-1151, HV-WeakBot-guest-2019-10-06-1654, HV-gineracos-Dumbot-2019-09-09-2025, HV-WeakBot-radamsuo16-2019-09-12-0610, HV-guest-WeakBot-2019-09-19-0903, HV-Dumbot-goosehead-2019-09-23-1605, HV-Dumbot-goosehead-2019-09-23-1649, HV-guest-SmartBot-2019-09-28-1527, HV-amartinez-WeakBot1-2020-04-15-2121, HV-GKobiec-WeakBot1-2020-04-16-2004, HV-riptide-Dumbot1-2020-04-14-1836, U!HV-Halafeeta-WeakBot1-2020-04-18-2217, HV-WeakBot-radamsuo16-2020-02-20-0134, HV-WeakBot-Kinsinator-2020-01-11-2129, HV-WeakBot-luko-2020-01-13-0414, HV-WeakBot-luko-2020-01-20-0814, U!HV-radamsuo16-WeakBot-2020-01-05-0438, HV-WeakBot0-rizeagain-2020-06-23-0324, HV-ez11235-WeakBot1-2020-03-07-0329, HV-ssmmww-WeakBot1-2020-03-06-2118, HV-WeakBot0-claymore-2020-05-15-2132, HV-Dumbot0-caprinus2-2020-05-19-0406, HV-lmartin-WeakBot1-2020-05-18-1158, HV-WeakBot0-guest-2020-05-28-0832, "
wL - bS1,https://entomology.appspot.com/hive.html?bg=0&color=1&grid=0&label=1&mode=edit&board=wL+0+0bS1-1+1&title=HV-Dumbot-Bechster-2015-04-10-1834%20::%20N:262%20whitewin:14%25%20blackwin:2%25%20draw:84%25,262,36,13.740458015267176,6,2.2900763358778624,220,83.96946564885496,"HV-andyy-omiomio-2020-03-28-0336, HV-BoardinATL-Dumbot1-2020-02-01-0317, HV-csigeee-SmartBot1-2020-04-19-1049, HV-BoardinATL-SmartBot1-2020-04-21-1902, HV-Quodlibet-SmartBot1-2020-04-20-1433, HV-Turkster-Gkobiec-2020-04-20-1409, T!HV-caprinus2-candimanf-2020-04-21-2030, T!HV-Mach3Racer-0Rose0-2020-04-20-1429, T!HV-SIDOREMI-pichu240-2020-04-21-0712, T!HV-Fredski-Leoon08-2020-04-22-1603, T!HV-hawk81-CBerserker-2020-04-23-0808, T!HV-zacbell-bonedigger-2020-04-25-1552, HV-shturik-SmartBot1-2020-04-28-1019, HV-luko-WeakBot1-2020-02-19-0850, HV-guest-SmartBot1-2020-02-04-1825, HV-UNtMySpvsr-SmartBot-2020-06-08-2140, HV-atropos945-WeakBot1-2020-06-19-1958, HV-guest-Dumbot1-2020-06-13-2147, HV-ManOfGlos-WeakBot1-2020-06-16-2155, HV-apolloq-Dumbot1-2020-06-20-0433, HV-guest-Frasco92-2020-06-24-2206, HV-UNtMySpvsr-WeakBot-2020-06-20-1312, HV-caprinus2-WeakBot1-2020-05-16-2131, HV-RaiD-Leoon08-2020-05-15-1520, T!HV-nevir-ronics-2020-04-30-1632, HV-SIDOREMI-Dumbot1-2020-05-19-2157, HV-UNtMySpvsr-WeakBot1-2020-05-19-0445, HV-UNtMySpvsr-WeakBot1-2020-05-19-0555, T!HV-docster-Candimanf-2020-05-17-1920, T!HV-docster-Candimanf-2020-05-17-1933, HV-Rufeo612-WeakBot-2020-05-03-1816, HV-claymore-SmartBot1-2020-05-09-0221, HV-atropos945-WeakBot1-2020-06-27-1501, HV-guest-Dumbot1-2020-07-05-2300, HV-Specialist-WeakBot1-2020-07-06-1628, HV-Specialist-WeakBot1-2020-07-06-1651, ","HV-Dumbot-andyy-2020-03-30-0458, T!HV-0Rose0-Mach3Racer-2020-04-20-1400, U!HV-WeakBot-OJpimpson-2020-05-31-1753, T!HV-Chrometal-stepanzo-2020-06-22-1400, T!HV-Geroid-CBerserker-2020-05-08-1132, HV-shturik-gandac-2020-07-01-0821, ","HV-Dumbot-Bechster-2015-04-10-1834, U!HV-Dumbot-TMarshal-2015-04-11-0102, HV-Dumbot-guest-2015-04-16-1232, HV-jew-Dumbot-2015-04-16-0323, U!HV-Dumbot-TMarshal-2015-04-19-0240, HV-jew-Dumbot-2015-04-20-0223, U!HV-Dumbot-TMarshal-2015-04-22-2322, U!HV-Quodlibet-Dumbot-2015-04-20-0406, U!HV-Dumbot-TMarshal-2015-04-06-0321, HV-Dumbot-guest-2015-11-30-1550, HV-Dumbot-guest-2015-11-30-1822, HV-Dumbot-cosmicat-2014-12-31-2334, HV-Bechster-Dumbot-2015-01-07-0940, HV-c4rl0s-Dumbot-2015-01-21-2302, HV-Dumbot-guest-2015-07-12-2011, U!HV-Dumbot-TMarshal-2015-07-13-0200, HV-Dumbot-domantos-2015-07-17-1517, HV-Dumbot-guest-2015-07-16-0204, HV-Dumbot-domantos-2015-07-18-1504, U!HV-ringersoll-Dumbot-2015-07-22-0051, U!HV-Dumbot-TMarshal-2015-07-04-2115, U!HV-Dumbot-TMarshal-2015-06-10-0057, HV-Dumbot-mhcper-2015-06-19-1152, HV-Dumbot-nono-2015-06-23-1858, HV-Dumbot-ryden-2015-06-23-0814, HV-Dumbot-dhop-2015-06-02-1700, HV-Dumbot-waj1951-2015-06-03-0043, HV-Dumbot-jrf715-2015-03-23-0000, HV-Bechster-shogi-2015-03-25-0900, HV-Quodlibet-durugyakos-2015-03-03-1927, HV-Dumbot-nbushfield-2015-03-08-0154, U!HV-Dumbot-TMarshal-2015-05-10-1809, HV-jew-Dumbot-2015-05-15-0122, U!HV-Dumbot-TMarshal-2015-05-11-0308, U!HV-Dumbot-TMarshal-2015-05-13-0105, U!HV-Dumbot-TMarshal-2015-05-15-2137, U!HV-Dumbot-TMarshal-2015-05-16-0037, HV-Bechster-TMarshal-2015-05-18-1954, U!HV-Dumbot-TMarshal-2015-05-16-1825, U!HV-Dumbot-TMarshal-2015-05-16-2015, U!HV-Dumbot-TMarshal-2015-05-18-1308, U!HV-Dumbot-TMarshal-2015-05-19-0151, HV-jew-Dumbot-2015-05-25-1403, HV-quasi-Dumbot-2015-05-24-0913, HV-Quodlibet-dai-2015-05-25-1914, U!HV-Dumbot-TMarshal-2015-05-24-0238, U!HV-jew-Dumbot-2015-05-26-0005, U!HV-jew-Dumbot-2015-05-26-2244, HV-Dumbot-cibci-2015-05-02-1738, HV-fbaumann-Dumbot-2015-05-01-1006, U!HV-Dumbot-TMarshal-2015-05-02-1558, HV-Dumbot-bertuccia-2015-09-24-1919, HV-Dumbot-zebrz-2016-04-23-1047, HV-Dumbot-blue1224-2016-04-03-1810, HV-Dumbot-shane-2016-03-30-0818, HV-Dumbot-piens-2016-07-29-0050, HV-Dumbot-higgsi-2016-08-08-1956, U!HV-beatljuice-guest-2016-02-03-1154, HV-Aristotle-Dumbot-2016-01-13-0738, HV-Dumbot-guest-2016-01-08-0400, HV-Dumbot-jrf715-2016-01-01-0719, HV-Dumbot-KDLadage-2016-01-03-1547, HV-Dumbot-kdladage-2016-01-05-1548, T!HV-bitsofgreg-dragonlord-2016-06-23-1808, T!HV-Quodlibet-dragonlord-2016-06-03-1951, HV-Dumbot-endzior-2016-03-18-1531, HV-Bodacity-dragonlord-2016-05-14-1534, T!HV-gabri-dragonlord-2016-05-15-2128, T!HV-bluess-jmklei0-2016-05-20-0228, HV-Sprinkhaan-isearch12-2016-05-08-1710, U!HV-pelle-Dumbot-2016-11-12-1701, HV-Dumbot-gdnskye-2016-11-19-0028, HV-jultou-Dumbot-2016-10-19-2141, HV-jultou-guest-2016-10-19-2309, HV-Dumbot-Dumbledore-2016-10-26-0916, HV-jultou-Dumbot-2016-09-15-2044, U!HV-Dumbot-TMarshal-2016-09-02-2110, U!HV-Dumbot-t1M0t8yk-2017-04-08-1651, HV-Dube-ddyer-2017-04-13-2234, HV-Dumbot-guest-2017-04-15-1601, HV-Dube-LaFleur98-2017-04-18-0626, HV-PrezTrump-ddyer-2017-04-20-0132, T!HV-iserp-phlegm-2017-04-19-1441, T!HV-nevir-beeman000-2017-04-19-1615, HV-jubal-Dumbot-2017-04-22-0258, U!HV-Dumbot-TMarshal-2017-08-06-1649, U!HV-Dumbot-TMarshal-2017-07-30-2328, U!HV-tongan-SmartBot-2017-07-30-0646, HV-Dumbot-guest-2017-11-29-1029, HV-Dumbot-guest-2017-02-12-1350, HV-Dumbot-seyo-2017-01-04-2021, U!HV-TMarshal-Dumbot-2017-07-07-2137, U!HV-Dumbot-TMarshal-2017-07-11-2328, U!HV-Dumbot-TMarshal-2017-07-15-1357, U!HV-Dumbot-TMarshal-2017-07-20-1801, U!HV-Dumbot-TMarshal-2017-07-28-0037, HV-Guybrush-ddyer-2017-06-18-2232, HV-Guybrush-Dumbot-2017-06-21-2352, U!HV-Dumbot-guest-2017-06-19-2119, HV-Radek0-Ragna-2017-06-06-1926, HV-Dube-Jaeyun-2017-03-13-1901, HV-Dube-Jaeyun-2017-03-16-1915, HV-Dube-Jaeyun-2017-03-16-1917, HV-Dumbot-flysuppo-2017-03-19-2312, U!HV-flysuppo-Dumbot-2017-03-26-0417, U!HV-guest-Dumbot-2017-03-01-1924, HV-flysuppo-dacajun-2017-05-10-0801, HV-BogdanM-beeman000-2017-05-15-1919, HV-prai0006-Dumbot-2017-05-17-0112, HV-Dube-ibmagic13-2017-05-17-1841, HV-Felixavier-Dumbot-2017-05-19-1913, U!HV-Dumbot-TMarshal-2017-10-30-1813, U!HV-Dumbot-TMarshal-2017-09-30-1140, HV-MacMac-seydel-2017-09-09-1925, HV-Dumbot-TMarshal-2017-09-14-2028, HV-nevir-SmartBot-2017-09-22-1846, U!HV-Cedricfou5-Dumbot-2017-09-23-0744, U!HV-Dumbot-TMarshal-2017-09-06-0003, U!HV-MacMac-seydel-2017-09-07-1703, U!HV-seydel-MacMac-2017-09-07-1327, HV-Dumbot-guest-2018-03-29-1548, T!HV-Gandac-Makajawan-2018-04-21-1900, HV-breakt-Dumbot-2018-04-25-0211, T!HV-davideg-phlegm-2018-04-25-2000, HV-nevir-alxndro-2018-04-02-1918, HV-WeakBot-Cathaoir-2018-08-12-0017, HV-WeakBot-Cathaoir-2018-08-13-2232, HV-dimitrif-zhuangzi-2018-08-14-1854, HV-WeakBot-Cathaoir-2018-08-16-1630, HV-WeakBot-Cathaoir-2018-08-19-0016, HV-zhuangzi-dimitrif-2018-08-15-1638, U!HV-WeakBot-guest-2018-12-10-1718, HV-Dumbot-jrf715-2018-11-28-0527, HV-nevir-Dumbot-2018-01-10-0537, HV-nevir-Dumbot-2018-01-15-0738, HV-WeakBot-guest-2018-07-13-1025, HV-dimitrif-Dumbot-2018-07-16-1316, HV-dimitrif-zhuangzi-2018-07-25-1409, T!HV-jfs489-Frasco92-2018-06-14-2217, HV-nevir-HollyPirat-2018-06-18-1744, HV-jsotelo-WeakBot-2018-06-22-1835, HV-neighlles-Dumbot-2018-06-25-0331, HV-WeakBot-guest-2018-06-01-1319, HV-neighlles-Dumbot-2018-06-06-1507, HV-MARO66-cjohnson-2018-05-06-2237, HV-sullamen-phlegm-2018-05-09-0103, HV-neighlles-Dumbot-2018-05-13-0053, HV-neighlles-Dumbot-2018-05-13-0144, HV-ruthhive-xrisponi-2018-05-10-2204, HV-ZoneCold-WeakBot-2018-05-11-0807, T!HV-Pivert94-Frasco92-2018-05-17-2029, HV-SmartBot-mullenc4-2018-05-19-0229, HV-nevir-c4nnes-2018-05-28-1922, HV-WeakBot-guest-2018-05-29-0350, HV-Mcbeup-CBerserker-2018-05-03-1719, T!HV-fbaumann-davideg-2018-05-03-1948, HV-Dumbot-guest-2018-09-30-1120, HV-mejiaff-Dumbot-2018-10-10-2014, U!HV-nick25-Dumbot-2018-10-13-1509, HV-Dumbot-Cathaoir-2018-09-09-0403, HV-Chrometal-ddyer-2018-09-16-0002, HV-sucitra-WeakBot-2018-09-15-1721, T!HV-Jewdoka-Quodlibet-2018-09-15-0231, HV-ElTemblo-WeakBot-2018-09-03-1112, HV-Juranur-WeakBot-2019-04-07-2229, HV-axljka-WeakBot-2019-04-21-0710, T!HV-HappyKiwi-lamsingyiu-2019-04-25-1449, HV-WeakBot-Prout-2019-04-02-2353, HV-saltylick-guest-2019-12-19-1612, U!HV-WeakBot-guest-2019-12-02-0625, U!HV-guest-WeakBot-2019-12-08-1654, HV-apolloq-WeakBot-2019-02-09-0408, HV-apolloq-WeakBot-2019-02-09-0433, HV-apolloq-WeakBot-2019-01-20-0325, HV-Dumbot-arrayking-2019-01-19-0302, HV-GFLima-Dumbot-2019-07-24-0410, HV-GFLima-Dumbot-2019-07-28-0828, HV-WeakBot-Cathaoir-2019-07-26-0132, HV-Forggotten-Dumbot-2019-07-03-0903, HV-WeakBot-guest-2019-06-05-2302, T!HV-shturik-eyelost-2019-06-06-1317, HV-BogdanM-WeakBot-2019-06-11-1938, T!HV-axljka-eyelost-2019-06-19-0907, HV-WeakBot-RogRab-2019-06-28-0343, HV-Dumbot-DeerPres-2019-05-31-0555, HV-Rekai-WeakBot-2019-05-31-1717, T!HV-Rekai-BogdanM-2019-06-03-1803, T!HV-stepanzo-Pseudomon-2019-06-04-0443, HV-Dumbot-ScoopyPoop-2019-02-27-0347, HV-shogi-WeakBot-2019-03-07-0320, U!HV-guest-SmartBot-2019-03-27-1149, HV-GFLima-Dumbot-2019-05-11-0648, HV-jaykeen-Dumbot-2019-05-12-2323, T!HV-Quodlibet-Pseudomon-2019-05-13-0502, U!HV-bdub89-SmartBot-2019-05-01-2209, HV-WeakBot-jrf715-2019-05-17-0242, HV-WeakBot-jrf715-2019-05-17-0245, T!HV-apolloq-BogdanM-2019-05-26-1820, T!HV-gameshark9-pillbugger-2019-05-26-2235, HV-WeakBot-veld-2019-05-02-2342, HV-WeakBot-veld-2019-05-07-0458, T!HV-neighlles-BogdanM-2019-05-05-1417, U!HV-TirKen-Dumbot-2019-11-24-0226, HV-gandac-Frasco92-2019-10-30-2139, HV-WeakBot-guest-2019-10-09-1001, HV-Rufeo612-WeakBot-2019-10-13-1453, HV-SmartBot-guest-2019-10-04-1527, U!HV-WeakBot-guest-2019-10-05-1606, HV-SmartBot-guest-2019-09-22-1021, HV-SmartBot-guest-2019-09-28-1706, HV-guest-SmartBot1-2020-02-13-0153, HV-WeakBot-Fresh-2020-01-11-0237, HV-luko-WeakBot-2020-01-16-0306, HV-WeakBot-guest-2020-01-18-1612, HV-UNtMySpvsr-SmartBot1-2020-06-18-1617, HV-UNtMySpvsr-SmartBot1-2020-06-04-1931, U!HV-Kimiko-Dumbot1-2020-06-07-1521, HV-andyy-omiomio-2020-03-26-0342, HV-SIDOREMI-Dumbot1-2020-04-29-0538, HV-WeakBot-Specialist-2020-07-07-0504, "
